"Id","Title","Time","Description","Link"
"129","Kamila Valieva, a Sensation in Beijing, Was an Exploding Star","1660793446000","The Russian teenager was the star of the Beijing Olympics, but disappeared in a flash.","https://www.nytimes.com/2022/08/17/sports/olympics/fame-kamila-valieva-figure-skating.html"
"130","Alexis Argüello Jr., Son of a Champion, Is His Own Man","1660793450000","Being the child of a famous athlete can come with unmatched privileges and unnerving scrutiny.","https://www.nytimes.com/2022/08/17/sports/fame-alexis-arguello-jr-boxing.html"
"131","Kelly Kay Green’s Grand Plan to Jump on the Field at the Super Bowl","1660793447000","Kelly Kay Green wanted to be someone. The internet rewarded a criminal stunt, because of course it did.","https://www.nytimes.com/2022/08/17/sports/football/fame-kelly-kay-green-super-bowl.html"
"132","Kevin Ware Jr. and the Injury That Follows Him Everywhere","1660793445000","Kevin Ware Jr. is best known for breaking his leg in a nationally televised N.C.A.A. tournament game. He is determined not to let the moment define him.","https://www.nytimes.com/2022/08/17/sports/basketball/fame-basketball-kevin-ware-jr.html"
"133","Ron Necciai, Who Struck Out 27, Is Still a Little Bit Famous","1660793448000","Ron Necciai whiffed a whole game’s worth of hitters, then disappeared from the sport. Our writer’s connection to him goes back to his childhood.","https://www.nytimes.com/2022/08/17/sports/baseball/fame-baseball-ron-necciai.html"
"134","FIFA World Cup Qatar 2022 Ticket Sales Top 2.45 Million, 500,000 Still Left","1660831849030","FIFA said 520,000 tickets were bought in a first-come, first-served phase of sales that closed this week. Brazil’s games against Serbia and Cameroon were among the most in-demand","https://www.news18.com/news/football/fifa-world-cup-qatar-2022-ticket-sales-top-2-45-million-500000-still-left-5777533.html"
"135","Cincinnati Open : Emma Raducanu Storms into Third Round, Iga Swiatek Also Through","1660831260030","World number one Iga Swiatek beat former U.S. Open winner Sloane Stephens 6-4 7-5 to start her campaign at the WTA 1000 tournament, the last big tune-up event before the hardcourt major kicks off in New York","https://www.news18.com/news/sports/cincinnati-open-emma-raducanu-storms-into-third-round-iga-swiatek-also-through-5777431.html"
"136","Western & Southern Open: Simona Halep Withdraws Due to Leg Injury","1660827884030","The 30-year-old was set to face Veronika Kudermetova in the second round. As a result, the Russian received a walkover into the round of 16 and will face either Paula Badosa or Ajla Tomljanovic","https://www.news18.com/news/sports/western-southern-open-simona-halep-withdraws-due-to-leg-injury-5776903.html"
"137","Teenage Basketball Player Suffers Multiple Fractures After She Resists Rape Attempt in Punjab's Moga","1660826540030","An 18-year-old basketball player suffered multiple fractures after three youths, who allegedly tried to rape her, pushed her off the roof of a stadium in Punjab’s Moga district","https://www.news18.com/news/sports/teenage-basketball-player-suffers-multiple-fractures-after-she-resists-rape-attempt-in-punjabs-moga-5777017.html"
"138","Bundesliga: Bayern Munich and Borussia Dortmund Setting the Pace in Germany","1660824918030","The two rivals are the only teams remaining with 100% records after two games of the Bundesliga, where they already occupy the places they had at the end of last season – first and second","https://www.news18.com/news/football/bundesliga-bayern-munich-and-borussia-dortmund-setting-the-pace-in-germany-5776513.html"
"139","Transfer News: Giovanni Simeone Joins Napoli on Season-long Loan","1660821816030","Giovanni Simeone is coming off his most prolific season in Serie A after scoring 17 goals for Verona last term","https://www.news18.com/news/football/transfer-news-giovanni-simeone-joins-napoli-on-season-long-loan-5776309.html"
"140","Jonas Vingegaard Having 'Tough Time' after Tour de France Triumph","1660819106030","Jonas Vingegaard has kept a low profile since winning the Tour de France in July and his triumphant return to Copenhagen","https://www.news18.com/news/sports/jonas-vingegaard-having-tough-time-after-tour-de-france-triumph-5775937.html"
"141","La Liga: Barcelona Look to Rebound After Early Setback","1660818804030","The Catalan club enters the second week of the season reeling and looking for ways to rebound. Another setback in a tough visit to Real Sociedad on Sunday could leave the club in a deep hole early on as Barcelona’s closest rivals all won their openers, with defending champion Real Madrid defeating promoted Almería and Atlético Madrid routing Getafe, both in away matches","https://www.news18.com/news/football/la-liga-barcelona-look-to-rebound-after-early-setback-5775817.html"
"142","Transfer News: Wolves Sign Portugal Midfielder Matheus Nunes For Club Record Fee","1660816776030","The Premier League club were understood to have agreed to pay Sporting an initial 45million euros for the 23-year-old, with a further five million euros in potential add-ons","https://www.news18.com/news/football/transfer-news-wolves-sign-portugal-midfielder-matheus-nunes-for-club-record-fee-5775565.html"
"143","Transfer News: Bayern Munich Defender Tanguy Nianzou Completes Sevilla Move","1660815816030","The centre-back arrived from Paris Saint-Germain two years ago but never looked convincing. He was mostly a backup and the arrival of Matthijs de Ligt has lessened his chances of starting","https://www.news18.com/news/football/transfer-news-bayern-munich-defender-tanguy-nianzou-completes-sevilla-move-5775481.html"
"144","Wish My Father Was With Us to See Me Play : Mumbai Khiladis' Gajanan Maruti Shengal","1660815300030","Mumbai Khiladis' Vice-Captain Gajanan Maruti Shengal said he wished his father was alive to see him perform in the Ultimate Kho Kho","https://www.news18.com/news/sports/wish-my-father-was-with-us-to-see-me-play-mumbai-khiladis-gajanan-maruti-shengal-5775361.html"
"145","No Bundesliga Format Changes 'In Near Future', Says Chairman Hans-Joachim Watzke","1660814988030","Watzke did not want to completely rule out reform &quot;at some point&quot; but said &quot;we cannot expect any changes in the next few years. In the near future, I don't see that happening&quot;","https://www.news18.com/news/football/no-bundesliga-format-changes-in-near-future-says-chairman-hans-joachim-watzke-5775175.html"
"146","Western & Southern Open: Emma Raducanu Defeats Victoria Azarenka in Second Round","1660813931030","Less than 24 hours after scoring a first-round win against 23-time Grand Slam champion Williams, Emma Raducanu was back on the court to face another former World No.1 in Victoria Azarenka and was similarly dominant. She dropped just two games in a 6-0, 6-2 win that lasted just 62 minutes to reach Round 3","https://www.news18.com/news/sports/western-southern-open-emma-raducanu-defeats-victoria-azarenka-in-second-round-5774947.html"
"147","Rafael Nadal Not Discouraged by Losing on Return, Says Will Be Ready for US Open","1660812843030","Rafael Nadal is going to be aiming for a record-extending 23rd Gram Slam title at the US Open","https://www.news18.com/news/sports/rafael-nadal-not-discouraged-by-losing-on-return-says-will-be-ready-for-us-open-5774851.html"
"148","Deontay Wilder to Return Against Robert Helenius in October","1660810454030","Deontay Wilder will return to the ring against Robert Helenius since the completion of his trilogy against Tyson Fury ","https://www.news18.com/news/sports/deontay-wilder-to-return-against-robert-helenius-in-october-5774401.html"
"149","LeBron James Agrees Two-year LA Lakers Extension for 97 Million USD: Reports","1660806190030","LeBron James has reportedly agreed to a two-year contract extension with the Los Angeles Lakers","https://www.news18.com/news/sports/lebron-james-agrees-two-year-la-lakers-extension-for-97-million-usd-reports-5773651.html"
"150","Mercedes F1 Boss Toto Wolff Takes Inspiration from Sir Alex Ferguson","1660805536030","Mercedes boss Toto Wolff revealed that he has taken learnings from Manchester United’s era of dominance under Sir Alex Ferguson in order to understand how great teams can sustain their success","https://www.news18.com/news/sports/mercedes-f1-boss-toto-wolff-takes-inspiration-from-sir-alex-ferguson-5771821.html"
"151","Atletico Madrid Reject Manchester United's Offer to Sign Joao Felix: Report","1660803641030","Amid rumours of a bid from Manchester United, Atletico Madrid posted a photo of Joao Felix on social media and wrote ‘Priceless’ in the caption","https://www.news18.com/news/football/atletico-madrid-reject-manchester-uniteds-offer-to-sign-joao-felix-report-5772247.html"
"152","Supreme Court to Hear Appeal of IOA against Delhi HC Order Setting Up Panel to Run it","1660802845030","SC took note of the submissions of the Solicitor General that the appointment of CoA may lead to the IOA's suspension by the International Olympic Committee as it happened in the case of the All India Football Federation","https://www.news18.com/news/sports/supreme-court-to-hear-appeal-of-ioa-against-delhi-hc-order-setting-up-panel-to-run-it-5772811.html"
"153","Champions Chess Tour: Rameshbabu Praggnanandhaa and Magnus Carlsen Neck-and-neck after Third Round","1660802152030","Rameshbabu Praggnanandhaa and Magnus Carlsen are neck-and-neck on a perfect 9/9 score in the FTX Crypto Cup","https://www.news18.com/news/sports/champions-chess-tour-rameshbabu-praggnanandhaa-and-magnus-carlsen-neck-and-neck-after-third-round-5772709.html"
"154","AEW Dynamite Results: Bryan Danielson Slays 'Dragonslayer' Daniel Garcia","1660801510030","Bryan Danielson defeated Daniel Garcia in a best of three falls in a gruelling encounter on HBO Max's House of the Dragon sponsored AEW Dynamite ","https://www.news18.com/news/sports/aew-dynamite-results-bryan-danielson-slays-dragonslayer-daniel-garcia-5772433.html"
"155","Rafael Nadal Loss at Cincinnati Masters Secures Daniil Medvedev's No. 1 Status","1660800988030","Rafael Nadal lost to Borna Coric in the Cincinnati Masters, ending his hopes of overtaking Daniil Medvedev for the world number one rankings","https://www.news18.com/news/sports/rafael-nadal-loss-at-cincinnati-masters-secures-daniil-medvedevs-no-1-status-5772541.html"
"156","US Open: Former Champion Dominic Thiem Among Others in Men's Singles Wild Cards List","1660798466030","Dominic Thiem, among others, got wild cards into the US Open men's singles main draw","https://www.news18.com/news/sports/us-open-former-champion-dominic-thiem-among-others-in-mens-singles-wild-cards-list-5772055.html"
"157","US Open 2022: Venus Williams, Sofia Kenin Lead Women's Singles Wild Cards List","1660796823030","Venus Williams and Sofia Kenin are part of the eight women who have received wild cards for the 2022 US Open women's singles main draw","https://www.news18.com/news/sports/us-open-2022-venus-williams-sofia-kenin-lead-womens-singles-wild-cards-list-5771977.html"
"158","Need to Practice: Rafael Nadal after Shock Loss to Borna Coric at Cincinnati Masters","1660795841030","Rafael Nadal lost to Borna Coric 7-6 (11/9), 4-6, 6-3 in the second round on return after a five-year absence from the ATP and WTA Cincinnati Masters","https://www.news18.com/news/sports/need-to-practice-rafael-nadal-after-shock-loss-to-borna-coric-at-cincinnati-masters-5771899.html"
"159","Ineos Billionaire Jim Ratcliffe 'Potential Buyer' of Manchester United","1660794013030","The Glazers have saddled Manchester United with huge debts after their leveraged buyout in 2005 and have long been accused of taking more out financially than they have invested","https://www.news18.com/news/football/ineos-billionaire-jim-ratcliffe-potential-buyer-of-manchester-united-5771701.html"
"160","UEFA Champions League Qualifiers: Benfica Take Control of Dynamo Kyiv Tie","1660793325030","Benfica defeated Dynamo Kyiv 2-0 in the first leg of their UEFA Champions League play-off tie","https://www.news18.com/news/football/uefa-champions-league-qualifiers-benfica-take-control-of-dynamo-kyiv-tie-5771635.html"
"161","Distracted Nick Kyrgios Crumbles as Andy Murray Falls and Emma Raducanu Rolls","1660792528030","Nick Kyrgios lost 6-3, 6-2 to Taylor Fritz as Andy Murray crashed out and Emma Raducanu won at the ATP and WTA Cincinnati Masters","https://www.news18.com/news/sports/distracted-nick-kyrgios-crumbles-as-andy-murray-falls-and-emma-raducanu-rolls-5771545.html"
"162","Impact Wrestling Extends Partnership With Eurosport India to Broadcast the Promotion's World-Class Content","1660791345030","Eurosport India viewers will be able to enjoy a slate of LIVE IMPACT Plus specials, as well as the promotion’s all-new Hindi-language series ‘Pehlwani Patakha’","https://www.news18.com/news/sports/impact-wrestling-extends-partnership-with-eurosport-india-to-broadcast-the-promotions-world-class-content-5771485.html"
"163","Durand Cup: Odisha FC Thrashes North East United FC 6-0","1660761862030","Jerry netted twice as Nandhakumar, Isak, Diego Mauricio and Thoiba Singh scored one each to help Odisha FC beat NorthEast United FC 6-0 in the Durand Cup","https://www.news18.com/news/sports/durand-cup-odisha-fc-thrashes-north-east-united-fc-6-0-5771179.html"
"164","Indian Olympic Association Discusses HC Order Thoroughly but no Decision on Approaching Apex Court","1660761538030","The Delhi High Court on Tuesday directed the setting up of a three-member CoA to take over the affairs of the IOA, saying its &quot;persistent recalcitrance&quot; to comply with the Sports Code made it imperative that its affairs be put in the hands of the committee","https://www.news18.com/news/sports/indian-olympic-association-discusses-hc-order-thoroughly-but-no-decision-on-approaching-apex-court-5771173.html"
"165","Gaganjeet Bhullar and Rashid Khan are Leading a Large Indian Contingent in Korea","1660760984030","Kim won the SK Telecom Open on the Korean PGA Tour in June on Jeju Island and although this week's USD 1.5 million event is being played at a different venue, Lotte Skyhill Country Club, he has high hopes for the week","https://www.news18.com/news/sports/gaganjeet-bhullar-and-rashid-khan-are-leading-a-large-indian-contingent-in-korea-5771149.html"
"166","Olympiastadion Rises in Awe of Tremendous Sportsmanship Portrayed by Andorran Athlete","1660760583030","During the Men’s 3000m steeplechase event, Nahuel Carabana assisted the injured race leader Axel Vang Christensen to his feet and then carried him off the racetrack after the Dane suffered a calf injury after jumping over a barrier a little over 300m into the race","https://www.news18.com/news/sports/olympiastadion-rises-in-awe-of-tremendous-sportsmanship-portrayed-by-andorran-athlete-5769301.html"
"167","Neeraj Chopra Figures in List of Diamond League Meeting Competitors","1660759982030","Neeraj Chopra missed the Birmingham CWG due to a &quot;minor&quot; groin strain he suffered while winning a historic silver in the World Championships in Eugene, USA last month.","https://www.news18.com/news/sports/neeraj-chopra-figures-in-list-of-diamond-league-meeting-competitors-5771101.html"
"168","Alison Riske-Amritraj Tops the Singles Entry List for the Chennai Open WTA tournament","1660759876030","Apart from Riske-Amritraj, the list of direct acceptances for the singles event includes Belgium's Elise Mertens","https://www.news18.com/news/sports/alison-riske-amritraj-tops-the-singles-entry-list-for-the-chennai-open-wta-tournament-5771047.html"
"169","Thailand Para Badminton International: Pramod Bhagat , Sukant Kadam Reach Semis in Men's Doubles And Quarters in Singles","1660759683030","In the men's doubles, Pramod and Sukant defeated Thailand's Mongkhon Bunsun and Siripong Teamarrom in straight sets with the score line of 21-17 and 22-20, they also defeated France's Faustine Noel and Lucas Mazur in straight sets to secure their semifinals spot","https://www.news18.com/news/sports/thailand-para-badminton-international-pramod-bhagat-sukant-kadam-reach-semis-in-mens-doubles-and-quarters-in-singles-5771077.html"
"170","Ryan Giggs Cites Disciplinary Record in Assault Trial","1660759576030","Giggs claims that injuries sustained by Greville were an accidental result of a three-way tussle between her and her sister over a mobile phone.","https://www.news18.com/news/football/ryan-giggs-cites-disciplinary-record-in-assault-trial-5771035.html"
"171","Anshul Bhatt Wins Triple Gold at U-16 World Youth Bridge Championships","1660759104030","He was awarded the Gold in Overall Performance in the U-16 category. Anshul, who has been playing bridge since the age of six, is the youngest winner of three Gold medals at the World Bridge championships where participants from over 30 countries took part","https://www.news18.com/news/sports/anshul-bhatt-wins-triple-gold-at-u-16-world-youth-bridge-championships-5771029.html"
"172","Gokulam Kerala Writes to the Prime Minister, Contacts the Sports Ministry, and Receives a 48-hour AFC extension in Tashkent","1660758710030","The team manager spoke as the players stood beside as a tight-knit unit adamant on not giving up hope in a game they were not expecting to be part of. The impassioned plea worked, as the ministry promptly took up the matter with the AFC, which offered the team an extension of 48 hours in Tashkent","https://www.news18.com/news/sports/gokulam-kerala-writes-to-the-prime-minister-contacts-the-sports-ministry-and-receives-a-48-hour-afc-extension-in-tashkent-5770861.html"
"173","Gujarat CM Bhupendra Patel Honours CWG Medallists From State","1660758486030","Harmit Desai, who won the gold in the table tennis team event, was awarded Rs 35 lakh; Bhavina Patel, the gold medallist in the para table tennis singles event, received Rs 25 lakh; while bronze medallist para athlete Sonal Patel was presented a cheque of Rs 10 lakh. Yasmika Bhatia and Radha Yadav, members of the women's cricket team received 5 lakh each","https://www.news18.com/news/sports/gujarat-cm-bhupendra-patel-honours-cwg-medallists-from-state-5770981.html"
"174","Ultimate Kho Kho: Gujarat Giants Ease Past Mumbai Khiladis","1660757797030","The Ranjan Shetty-led Gujarat Giants notched up a dominating 18-point win. They had earlier defeated Mumbai Khiladis by 25 points in the league opener","https://www.news18.com/news/sports/ultimate-kho-kho-gujarat-giants-ease-past-mumbai-khiladis-5770951.html"
"175","Jungle Rumble: Vijender Singh Knocks Eliasu Sulley Out to Return to Winning Ways","1660756479030","The 36-year-old Beijing Olympics bronze medallist needed only five minutes and seven seconds to dispatch the Ghanian, who till now had a 100 per cent knockout record","https://www.news18.com/news/sports/jungle-rumble-vijender-singh-knocks-eliasu-sulley-out-to-return-to-winning-ways-5770897.html"
"176","Mike Tyson is Seen in a Wheelchair After Predicting his Death'Really Soon'","1660753035030","The 56-year-old was wheeled through the terminal at Miami International Airport. He was carrying a walking stick with him while posing for selfies with fans","https://www.news18.com/news/sports/mike-tyson-is-seen-in-a-wheelchair-after-predicting-his-deathreally-soon-5770747.html"
"177","Khelo India Junior Women's Swimming Challenge Series to be Held Across 5 Zones","1660751568030","This is the first time ever that a Swimming Zonal Competition of this magnitude is being organized for the Junior (U-18) and Youth (U-15) categories for girls. The total entries across all events and zones are over 2000","https://www.news18.com/news/sports/khelo-india-junior-womens-swimming-challenge-series-to-be-held-across-5-zones-5770693.html"
"178","Adani Sportsline Owned Gulf Giants Announce Squad for UAE ILT20","1660751033030","Former Zimbabwe captain Andy Flower, who has three decades of cricketing experience, will be the head coach of the side.The 54-year-old was also the head coach of the Lucknow Super Giants in the IPL 2022","https://www.news18.com/news/sports/adani-sportsline-owned-gulf-giants-announce-squad-for-uae-ilt20-5770585.html"
"179","Cristiano Ronaldo Cautioned by Police After Allegedly Slapping Phone From Fan's Hand","1660750682030","The 37-year-old was interviewed by officers in relation to an allegation of assault and criminal damage following the incident at Goodison Park on April 9. Merseyside Police launched an investigation after a clip was circulated online of Ronaldo appearing to knock the supporter's mobile phone onto the ground as he limped towards the tunnel following United's 1-0 loss","https://www.news18.com/news/football/cristiano-ronaldo-cautioned-by-police-after-allegedly-slapping-phone-from-fans-hand-5770687.html"
"180","Kerala Blasters Sign Bidyashagar Singh on Loan From Bengaluru FC","1660749641030","The 24-year-old striker, a product of the Tiddim Road Athletic Union FC academy, started his career with East Bengal FC in 2016. He first came into prominence when he took the Kolkata side's U18 team to the finals of the 2016-17 U18 I-League, scoring 6 goals along the way","https://www.news18.com/news/football/kerala-blasters-sign-bidyashagar-singh-on-loan-from-bengaluru-fc-5770615.html"
"181","Hockey India Election Process to be Completed by October 9, Say FIH and CoA in Joint Statement","1660748644030","A two-member delegation from the FIH is in the national capital to discuss the way forward and avert a possible suspension of Hockey India, currently placed under a CoA on the directive of the Delhi High Court","https://www.news18.com/news/sports/hockey-india-election-process-to-be-completed-by-october-9-say-fih-and-coa-in-joint-statement-5770591.html"
"182","France's Gael Monfils Ruled Out of US Open With Foot Injury","1660747720030","The 35-year-old clashed with rising British star Jack Draper in the Montreal Masters last-16 on Thursday. At the start of the second set, Monfils sustained a foot injury and he required immediate intervention","https://www.news18.com/news/sports/frances-gael-monfils-ruled-out-of-us-open-with-foot-injury-5770489.html"
"183","According to CWG Medalist Saurav Ghosal, Squash has Finally Been Shortlisted for the 2028 Olympics","1660746840030","Squash, while recognised by the International Olympic Committee, is still not a part of the Olympics citing that the game's actions would be difficult to follow for the spectators, especially via television","https://www.news18.com/news/sports/according-to-cwg-medalist-saurav-ghosal-squash-has-finally-been-shortlisted-for-the-2028-olympics-5770375.html"
"184","Transfer News: PSG's German Defender Thilo Kehrer Joins West Ham","1660746328030","Kehrer, 25, has signed a four-year contract with the Premier League club, with the option of a two-year extension, for a reported £10.1 million","https://www.news18.com/news/football/transfer-news-psgs-german-defender-thilo-kehrer-joins-west-ham-5770387.html"
"185","SC Asks Centre to Take Pro-active Role in Facilitating Holding of U-17 Women's World Cup","1660744600030","The top court deferred till the August 22 hearing on the AIFF matter after the Centre said it is in discussion with the International Football Federation (FIFA) over the holding of the U-17 Women's world cup in India.","https://www.news18.com/news/football/sc-asks-centre-to-take-pro-active-role-in-facilitating-holding-of-u-17-womens-world-cup-5770159.html"
"186","Europa Conference League: Danish Club Viborg's African Players Denied British Entry to Play West Ham","1660740391030","Entry visas were not processed in time for Nigerian player Ibrahim Said and Gambian forward Alassana Jatta to play in London on Thursday in the playoff round of the third-tier European competition","https://www.news18.com/news/football/europa-conference-league-danish-club-viborgs-african-players-denied-british-entry-to-play-west-ham-5769361.html"
"187","Transfer News: Brighton Sign Ecuador Defender Pervis Estupinan From Villarreal","1660737731030","The 24-year-old Estupinan has signed a five-year deal, subject to international clearance. Brighton did not disclose the financial details of the deal","https://www.news18.com/news/football/transfer-news-brighton-sign-ecuador-defender-pervis-estupinan-from-villarreal-5768509.html"
"188","Dates for Rescheduled Asian Para Games Announced","1660737209030","The Asian Paralympic Committee (APC) and the Hangzhou Asian Para Games Organising Committee (HAPGOC), the local organising committee, on Wednesday announced that the fourth edition of the Asian Para Games, originally scheduled to be held in October this year, will now take place from October 22 to 28, 2023","https://www.news18.com/news/sports/dates-for-rescheduled-asian-para-games-announced-5769097.html"
"189","European Athletics Championships 2022: German Teenager Arrested for Hitler Salute to Israeli Athletes","1660736333030","The 16 athletes from the Israeli European Championships team were visiting the Olympic Park in Munich on Tuesday evening when the banned gesture was made by a 19-year-old security guard from Berlin, police said in a statement","https://www.news18.com/news/sports/european-athletics-championships-2022-german-teenager-arrested-for-hitler-salute-to-israeli-athletes-5768875.html"
"190","Durand Cup: Sunil Chhetri and Roy Krishna Combine to Help Bengaluru FC Beat Jamshedpur FC 2-1","1660735035030","Sunil Chhetri and Roy Krishna scored as Bengaluru FC defeated a second-string Jamshedpur FC side in the Durand Cup","https://www.news18.com/news/football/durand-cup-sunil-chhetri-and-roy-krishna-combine-to-help-bengaluru-fc-beat-jamshedpur-fc-2-1-5768671.html"
