"Id","Title","Time","Description","Link"
"316","Don't Pay Too Much Attention: Sunil Chhetri Tells Indian Players on Threat of a FIFA Ban","1660471168030","Sunil Chhetri said Indian footballers should continue giving their best on the pitch and not worry about the threat of a FIFA ban ","https://www.news18.com/news/football/dont-pay-too-much-attention-sunil-chhetri-tells-indian-players-on-threat-of-a-fifa-ban-5750581.html"
"317","Indian Boxers Need to Punch above Their Weight to Bring Home Medals from Paris","1660470324030","A boxing coach on condition of anonymity said that the boxers will have to work really hard if they want to achieve a medal in the Paris Olympics","https://www.news18.com/news/sports/indian-boxers-need-to-punch-above-their-weight-to-bring-home-medals-from-paris-5750437.html"
"318","Durand Cup 2022: All You Need to Know about India's Oldest Football Tournament","1660468047030","Here are the start time, groups, teams and where to watch on TV and live Streaming for the 131st edition of the historic Durand Cup","https://www.news18.com/news/football/durand-cup-2022-all-you-need-to-know-about-indias-oldest-football-tournament-5740357.html"
"319","Liverpool vs Crystal Palace Live Streaming: When and Where to Watch EPL 2022-23 Live Coverage on Live TV Online","1660467045030","Here you can get all the live streaming details as to when, where, and how you can watch the Premier League clash between Liverpool vs Crystal Palace","https://www.news18.com/news/football/liverpool-vs-crystal-palace-live-streaming-when-and-where-to-watch-epl-2022-23-match-live-coverage-on-live-tv-online-5745547.html"
"320","Nikhat Zareen Gifts Boxing Gloves to PM Modi, Hima Das Presents Traditional Gamocha","1660465903030","PM Modi hosted the Indian contingent at his residence to felicitate the CWG athletes. The Indian athletes produced a sensational show in Birmingham, claiming 61 medals, including 22 gold, 16 silver and 23 bronze","https://www.news18.com/news/sports/nikhat-zareen-gifts-boxing-gloves-to-pm-modi-hima-das-presents-traditional-gamocha-5750131.html"
"321","No Olympic Future for CWG Lawn Bowl Heroes, Squash Players","1660464952030","Lawn bowls as a sport is not part of the Olympics and it's up to the stakeholders and decision-makers of the game to include it in future. Now that India have won medals at CWG, the game could reach greater heights in terms of popularity.","https://www.news18.com/news/sports/no-olympic-future-for-cwg-lawn-bowl-heroes-squash-players-5750101.html"
"322","GPBL: KGF Wolves Win Thriller Against Malnad Falcons; Bengaluru Lions Edge Mysore Panthers","1660463074030","With both the teams, tied at 3-3 at the end of the fourth match, KGF Wolves, boosted by the presence of mentor HS Prannoy, won the match decider (Super Match) to bag three points and surge ahead of their rivals Malnad Falcons in their group B encounter in the Grand Prix Badminton League (GPBL) at the Karnataka Badminton Association","https://www.news18.com/news/sports/gpbl-kgf-wolves-win-thriller-against-malnad-falcons-bengaluru-lions-edge-mysore-panthers-5750035.html"
"323","Canadian Open: Hubert Hurkacz Topples Casper Ruud to Set Montreal Final Against Pablo Carreno Busta","1660462573030","Poland's Eighth-seeded Hurkacz needed two hours to claim a 5-7, 6-3, 6-2 victory over his Norwegian opponent, who had dropped just one set all week","https://www.news18.com/news/sports/canadian-open-hubert-hurkacz-topples-casper-ruud-to-set-montreal-final-against-pablo-carreno-busta-5749993.html"
"324","AIFF Includes Eminent Players in Electoral College for August 28 Elections","1660461196030","The list of 36 eminent players includes the likes of Bhaichung Bhutia, IM Vijayan, Shabbir Ali, Climax Lawrence, Rendey Singh and Jo Paul Ancheri, among others and also has 12 female representatives including O. Bembem Devi","https://www.news18.com/news/football/aiff-includes-eminent-players-in-electoral-college-for-august-28-elections-5749819.html"
"325","European Aquatics Championships 2022: David Popovici Breaks 100m Freestyle World Record","1660457804030","The 17-year-old Romanian double world champion swam 46.86sec to slice 0.05sec off the old mark set by Brazilian Cesar Cielo in the 2009 World Championships, also in Rome, in the era of buoyant body suits","https://www.news18.com/news/sports/european-aquatics-championships-2022-david-popovici-breaks-100m-freestyle-world-record-5749609.html"
"326","World Junior Squash Championships: India's Anahat Singh Enters Quarter-finals","1660456511030","The 14-year-old defeated England's Torrie Malik 11-5, 11-5, 6-1, 11-7 and will face Egypt's Fayrouz Abouelkheir for a place in the semifinals","https://www.news18.com/news/sports/world-junior-squash-championships-indias-anahat-singh-enters-quarter-finals-5749453.html"
"327","EFL Championship: Hull City Top Table as Norwich Remain Winless","1660456366030","Hull went to the top of English football's second-tier Championship with a 2-1 victory over Norwich on Saturday which meant the Canaries remained without a win","https://www.news18.com/news/football/efl-championship-hull-city-top-table-as-norwich-remain-winless-5749513.html"
"328","Carlo Ancelotti to Call Time on Managerial Career Post Real Madrid Stint","1660454578030","Ancelotti had said in May that he would &quot;probably&quot; quit once he left Madrid, but he removed all doubt in an interview with Italian daily Il Messaggero","https://www.news18.com/news/football/carlo-ancelotti-to-call-time-on-managerial-career-post-real-madrid-stint-5749435.html"
"329","Bundesliga: Timo Werner Nets on RB Leipzig Return in 2-2 Draw With Cologne","1660453275030","Leipzig played the majority of the game with 10 men after Hungary midfielder Dominik Szoboszlai received a straight red card for an elbow to the throat of Florian Kainz just before halftime. But, goals from Werner and Christopher Nkunku salvaged a point","https://www.news18.com/news/football/bundesliga-timo-werner-nets-on-rb-leipzig-return-in-2-2-draw-with-cologne-5749399.html"
"330","Serie A: Romelu Lukaku, Denzel Dumfries Star in Inter's 2-1 Win Over Lecce","1660452338030","Lukaku nodded home from close range with only 81 seconds gone to give Inter the lead at the Stadio Via del Mare before Dumfries stole the headlines with a 94th-minute strike just as Inter looked to have dropped points at promoted Lecce","https://www.news18.com/news/football/serie-a-romelu-lukaku-denzel-dumfries-star-in-inters-2-1-win-over-lecce-5749351.html"
"331","Serie A: AC Milan Start Title Defense With 4-2 Opening Day Win Over Udinese","1660452010030","Milan bounced back from going behind with less than two minutes on the clock to claim the three points thanks to two goals from Ante Rebic, a Theo Hernando penalty and a strike from Brahim Diaz","https://www.news18.com/news/football/serie-a-ac-milan-start-title-defense-with-4-2-opening-day-win-over-udinese-5749297.html"
"332","La Liga: Barcelona Open Campaign With Goalless Draw Against Rayo Vallecano","1660450451030","Barcelona were held 0-0 by Rayo Vallecano in their opening game of the La Liga season and had captain Sergio Busquets sent off late on. The Catalans had 21 shots on goal and the majority of possession at the Camp Nou but were unable to break the deadlock","https://www.news18.com/news/football/la-liga-barcelona-open-campaign-with-goalless-draw-against-rayo-vallecano-5749207.html"
"333","Ligue1: Neymar Double Leads PSG to Thumping Win Over Montpellier","1660449527030","Neymar continued his outstanding start to the season with a brace while Kylian Mbappe marked his return to the team with a goal but also had a penalty saved as Paris Saint-Germain trounced Montpellier 5-2 in Ligue 1 on Saturday","https://www.news18.com/news/football/ligue1-neymar-double-leads-psg-to-thumping-win-over-montpellier-5749165.html"
"334","""Made Blunder"": Ex-Pak Star On Babar-Led Side's Approach Ahead of T20 WC","1660831207000","Expectations will be high from the Pakistan cricket team in the 2022 T20 World Cup","https://sports.ndtv.com/cricket/pakistan-made-a-blunder-former-star-on-babar-azam-led-sides-approach-ahead-of-t20-world-cup-3266191"
"335","Chahar Shines On Return As India Thump Zimbabwe By 10 Wickets","1660830462000","Donning the blue jersey for the first time in six months after a long injury lay-off, Chahar hit the straps right away with figures of 3/27","https://sports.ndtv.com/cricket/india-beat-zimbabwe-by-10-wickets-to-take-1-0-lead-in-3-match-series-3266145"
"336","""Maintain Your Fitness"": Pakistan Fans Troll Babar Azam Over New Photos","1660827347000","Babar Azam will lead Pakistan in the upcoming Asia Cup where the team will clash with arch rivals India in a blockbuster match on August 28.","https://sports.ndtv.com/cricket/maintain-your-fitness-pakistan-fans-troll-babar-azam-over-new-photos-3265927"
"337","""Put An End To It"": Cricketer Chahal Clarifies After Divorce Rumours","1660825311000","Yuzvendra Chahal and his wife Dhanashree are extremely popular on social media as they keep posting videos together. The duo tied the knot in December 2020.","https://sports.ndtv.com/cricket/put-an-end-to-it-cricketer-yuzvendra-chahal-clarifies-after-divorce-rumours-with-wife-dhanashree-3265804"
"338","Mohammed Siraj To Play Warwickshire's Last Three County Games","1660823959000","Mohammed Siraj will join the English county bandwagon as he gears up to play Warwickshire's last three first-class games in September","https://sports.ndtv.com/cricket/mohammed-siraj-to-play-warwickshires-last-three-county-games-3265730"
"339","Sachin ""Was Sledged By Afridi"": Sehwag Shares Details Of 2003 WC Knock","1660823214000","Talking about the moment when he came out to run for Tendulkar, when the Indian batting talisman was battling cramps, Sehwag said that Sachin was beingsledged by Pakistan's Shahid Afridi and other...","https://sports.ndtv.com/cricket/sachin-was-sledged-by-afridi-virender-sehwag-shares-details-of-2003-world-cup-knock-3265689"
"340","""Pressure On Management..."": Hafeez After Pak's Close Win Over Netherlands","1660821466000","Former Pakistan captain and all-rounder Mohammad Hafeez feels the team management will now be under pressure to play a full strength squad in the second match of the series.","https://sports.ndtv.com/cricket/pressure-on-team-management-hafeez-after-pakistans-close-win-over-netherlands-in-1st-odi-3265580"
"341","Zimbabwe vs India: Zimbabwe vs India 2022 Live Cricket Score, Live Score Of Today's Match on NDTV Sports","1660820097000","Live Updates of Today Match between Zimbabwe vs India from Harare Sports Club, Harare. Check commentary and full scoreboard of the match.","https://sports.ndtv.com/cricket/zimbabwe-vs-india-live-score-over-1st-odi-odi-41-45-updates-3265361"
"342","Zimbabwe vs India: Zimbabwe vs India 2022 Live Cricket Score, Live Score Of Today's Match on NDTV Sports","1660818327000","Live Updates of Today Match between Zimbabwe vs India from Harare Sports Club, Harare. Check commentary and full scoreboard of the match.","https://sports.ndtv.com/cricket/zimbabwe-vs-india-live-score-over-1st-odi-odi-36-40-updates-3265261"
"343","1st Test, Day 2, Live: Dean Elgar, Sarel Erwee Give SA Steady Start","1660817446000","England vs South Africa, 1st Test, Day 2 Live: Dean Elgar, Sarel Erwee gave South Africa a steady start","https://sports.ndtv.com/cricket/england-vs-south-africa-1st-test-day-2-live-updates-3265286"
"344","Zimbabwe vs India: Zimbabwe vs India 2022 Live Cricket Score, Live Score Of Today's Match on NDTV Sports","1660816969000","Live Updates of Today Match between Zimbabwe vs India from Harare Sports Club, Harare. Check commentary and full scoreboard of the match.","https://sports.ndtv.com/cricket/zimbabwe-vs-india-live-score-over-1st-odi-odi-31-35-updates-3265203"
"345","Zimbabwe vs India Live Score Ball by Ball, Zimbabwe vs India 2022 Live Cricket Score Of Today's Match on NDTV Sports","1660815941000","Live Updates of Today Match between Zimbabwe vs India from Harare Sports Club, Harare. Check commentary and full scoreboard of the match.","https://sports.ndtv.com/cricket/zimbabwe-vs-india-live-score-over-1st-odi-odi-26-30-updates-3265118"
"346","Zimbabwe vs India Live Score Ball by Ball, Zimbabwe vs India 2022 Live Cricket Score Of Today's Match on NDTV Sports","1660814526000","Live Updates of Today Match between Zimbabwe vs India from Harare Sports Club, Harare. Check commentary and full scoreboard of the match.","https://sports.ndtv.com/cricket/zimbabwe-vs-india-live-score-over-1st-odi-odi-21-25-updates-3265062"
"347","Zimbabwe vs India: Zimbabwe vs India 2022 Live Cricket Score, Live Score Of Today's Match on NDTV Sports","1660813505000","Live Updates of Today Match between Zimbabwe vs India from Harare Sports Club, Harare. Check commentary and full scoreboard of the match.","https://sports.ndtv.com/cricket/zimbabwe-vs-india-live-score-over-1st-odi-odi-16-20-updates-3264995"
"348","Who Is Sanju Samson's Favourite Sportsperson? India Star Reveals Choice","1660812970000","In a video posted on the Twitter handle of BCCI, Samson was seen answering a rapid fire, where he revealed MS Dhoni, as his favourite sports personality.","https://sports.ndtv.com/cricket/who-is-sanju-samsons-favourite-sportsperson-team-india-star-reveals-his-choice-3265037"
"349","2nd ODI Live: Pakistan Face Early Blows, Vivian Kingma Sends Openers Back","1660812293000","NED vs PAK, 2nd ODI Live Updates: Pakistan faced an early blow as Vivian Kingma dismissed Fakhar Zaman and Imam Ul Haq in the same over","https://sports.ndtv.com/cricket/netherlands-vs-pakistan-2nd-odi-live-score-updates-3265003"
"350","Zimbabwe vs India: Zimbabwe vs India 2022 Live Cricket Score, Live Score Of Today's Match on NDTV Sports","1660812124000","Live Updates of Today Match between Zimbabwe vs India from Harare Sports Club, Harare. Check commentary and full scoreboard of the match.","https://sports.ndtv.com/cricket/zimbabwe-vs-india-live-score-over-1st-odi-odi-11-15-updates-3264904"
"351","Zimbabwe vs India Live Score Ball by Ball, Zimbabwe vs India 2022 Live Cricket Score Of Today's Match on NDTV Sports","1660810402000","Live Updates of Today Match between Zimbabwe vs India from Harare Sports Club, Harare. Check commentary and full scoreboard of the match.","https://sports.ndtv.com/cricket/zimbabwe-vs-india-live-score-over-1st-odi-odi-6-10-updates-3264816"
"352","""Even In A Room Full Of People Who Support, Love Me, I Felt Alone"": Kohli","1660809027000","Virat Kohli said it was important for athletes to rest and recover from the pressures of sport and reconnect with their ""core self"".","https://sports.ndtv.com/cricket/even-in-a-room-full-of-people-who-support-and-love-me-i-felt-alone-virat-kohli-3264821"
"353","Zimbabwe vs India Live Score Ball by Ball, Zimbabwe vs India 2022 Live Cricket Score Of Today's Match on NDTV Sports","1660808787000","Live Updates of Today Match between Zimbabwe vs India from Harare Sports Club, Harare. Check commentary and full scoreboard of the match.","https://sports.ndtv.com/cricket/zimbabwe-vs-india-live-score-over-1st-odi-odi-1-5-updates-3264679"
"354"," Zimbabwe vs India: Good to be back, says KL Rahul after registering 1st win as India captain ","1660830450030","     ZIM v IND: Good to be back, says KL Rahul after 1st win as India captain"," https://www.indiatoday.in/sports/cricket/story/zimbabwe-vs-india-1st-odi-kl-rahul-win-captain-injury-return-1989633-2022-08-18?utm_source=rss "
"355"," Shikhar Dhawan, Shubman Gill, Deepak Chahar hand India 10-wicket ODI win over Zimbabwe ","1660828195030","     Dhawan, Gill, Chahar hand India 10-wicket ODI win over Zimbabwe"," https://www.indiatoday.in/sports/cricket/story/zimbabwe-vs-india-1st-odi-score-report-shikhar-dhawan-shubman-gill-deepak-1989623-2022-08-18?utm_source=rss "
"356"," Zimbabwe vs India | KL Rahul should have opened to get game time ahead of Asia Cup, says Dodda Ganesh ","1660827310030","     ZIM vs IND | KL Rahul should have opened to get game time: Ganesh"," https://www.indiatoday.in/sports/cricket/story/zim-vs-ind-1st-odi-why-kl-rahul-did-not-open-dodda-ganesh-asia-cup-1989613-2022-08-18?utm_source=rss "
"357"," Dinesh Karthik recalls Rohit Sharma's struggle in Test cricket: There were many curve balls thrown at him ","1660826966030","     Dinesh Karthik recalls Rohit Sharma's struggle in Test cricket"," https://www.indiatoday.in/sports/cricket/story/dinesh-karthik-recalls-rohit-sharma-s-struggle-in-test-cricket-there-were-many-curve-balls-thrown-at-him-1989612-2022-08-18?utm_source=rss "
"358"," India pacer Mohammed Siraj signs for Warwickshire in County Championship ","1660823020030","     Mohammed Siraj signs for Warwickshire in County Championship"," https://www.indiatoday.in/sports/cricket/story/india-pacer-mohammed-siraj-joins-warwickshire-for-county-championship-1989571-2022-08-18?utm_source=rss "
"359"," I am positive: Rafael Nadal brushes aside Cincinnati Open defeat, says he will be ready for US Open 2022 ","1660821635030","     I am positive: Nadal not discouraged by Cincinnati defeat ahead of US Open"," https://www.indiatoday.in/sports/tennis/story/rafael-nadal-us-open-2022-cincinnati-masters-defeat-borna-not-discouraged-1989557-2022-08-18?utm_source=rss "
"360"," ZIM vs IND: Deepak Chahar runs through Zimbabwe top order, clinches career-best figures ","1660821376030","     Deepak Chahar runs through Zimbabwe top order, clinches career-best figures"," https://www.indiatoday.in/sports/cricket/story/zim-vs-ind-deepak-chahar-runs-through-zimbabwe-top-order-clinches-career-best-figures-1989563-2022-08-18?utm_source=rss "
"361"," Sanjay Manjrekar makes bold prediction for India's T20 World Cup line-up: Shikhar Dhawan will open ","1660817880030","     Sanjay Manjrekar predicts Shikhar Dhawan will open for India in T20 World Cup"," https://www.indiatoday.in/sports/cricket/story/sanjay-manjrekar-makes-bold-prediction-for-india-s-t20-world-cup-line-up-shikhar-dhawan-will-open-1989531-2022-08-18?utm_source=rss "
"362"," Sanjay Manjrekar feels Zimbabwe series will be testing ground for Deepak Chahar ahead of T20 World Cup ","1660815383030","     Manjrekar feels Zimbabwe series will be testing ground for Chahar ahead of T20 WC"," https://www.indiatoday.in/sports/cricket/story/sanjay-manjrekar-feels-zimbabwe-series-will-be-testing-ground-for-deepak-chahar-ahead-of-t20-world-cup-1989510-2022-08-18?utm_source=rss "
"363"," Supreme Court orders status quo, says Delhi HC-appointed CoA will not take over affairs of IOA ","1660808590030","     SC orders status quo, says Delhi HC-appointed CoA will not take over affairs of IOA"," https://www.indiatoday.in/sports/other-sports/story/supreme-court-orders-status-quo-says-delhi-hc-appointed-coa-will-not-take-over-affairs-of-ioa-1989438-2022-08-18?utm_source=rss "
"364"," Serena Williams is on the same level as Michael Jordan, LeBron James and Tom Brady: John McEnroe ","1660807912030","     Serena Williams is on the same level as Jordan, LeBron and Brady: McEnroe"," https://www.indiatoday.in/sports/tennis/story/serena-williams-is-on-the-same-level-as-michael-jordan-lebron-james-and-tom-brady-john-mcenroe-1989439-2022-08-18?utm_source=rss "
"365"," Zimbabwe vs India | Good chance to challenge yourself: KL Rahul looking forward to a good outing in 1st ODI ","1660807008030","     ZIM vs IND, 1st ODI | Good chance to challenge yourself: KL Rahul "," https://www.indiatoday.in/sports/cricket/story/zimbabwe-vs-india-good-chance-to-challenge-yourself-kl-rahul-looking-forward-to-a-good-outing-in-1st-odi-1989428-2022-08-18?utm_source=rss "
"366"," Don’t think Sebastian Vettel saw prospect of Aston Martin making podium finishes in 2023: Helmut Marko ","1660803650030","     Don’t think Vettel saw prospect of Aston Martin making podium finishes in 2023: Marko"," https://www.indiatoday.in/sports/formula-one/story/don-t-think-sebastian-vettel-saw-prospect-of-aston-martin-making-podium-finishes-in-2023-helmut-marko-1989389-2022-08-18?utm_source=rss "
"367"," Pakistan rely heavily on Babar Azam and Mohammad Rizwan, their middle-order a weak link: Danish Kaneria ","1660803430030","     Pakistan rely heavily on Babar Azam and Mohammad Rizwan: Danish Kaneria"," https://www.indiatoday.in/sports/cricket/story/danish-kaneria-exclusive-pakistan-cricket-babar-rizwan-1989381-2022-08-18?utm_source=rss "
"368"," Olympic champion Neeraj Chopra likely to make comeback in Diamond League Meeting on August 26 ","1660799835030","     Olympic champion Neeraj likely to make comeback in Diamond League Meeting "," https://www.indiatoday.in/sports/other-sports/story/olympic-champion-neeraj-chopra-likely-to-make-comeback-in-diamond-league-meeting-on-august-26-1989331-2022-08-18?utm_source=rss "
"369"," It's been an honour: Virat Kohli shares special video with fans on 14th anniversary of international debut ","1660799644030","     Virat Kohli shares special video with fans on 14th anniversary of international debut"," https://www.indiatoday.in/sports/cricket/story/it-s-been-an-honour-virat-kohli-shares-special-video-with-fans-on-14th-anniversary-of-international-debut-1989333-2022-08-18?utm_source=rss "
"370"," These talks are nonsense: Rohit Sharma brushes aside concerns about future of ODI cricket ","1660797441030","     Rohit Sharma brushes aside concerns about future of ODI cricket"," https://www.indiatoday.in/sports/cricket/story/these-talks-are-nonsense-rohit-sharma-brushes-aside-concerns-about-future-of-odi-cricket-1989321-2022-08-18?utm_source=rss "
"371"," ENG vs SA, 1st Test: Paul Collingwood confident England can hit back after tough first day at Lord’s ","1660797270030","     ENG vs SA: Paul Collingwood confident England can return fire at Lord's"," https://www.indiatoday.in/sports/cricket/story/eng-vs-sa-1st-test-paul-collingwood-confident-england-can-hit-back-after-tough-first-day-at-lord-s-1989319-2022-08-18?utm_source=rss "
"372"," Cincinnati Masters 2022: Rafael Nadal bows out in 2nd round after losing to Borna Coric ","1660795806030","     Cincinnati Masters 2022: Rafael Nadal bows out in 2nd round"," https://www.indiatoday.in/sports/tennis/story/cincinnati-masters-2022-rafael-nadal-bows-out-in-pre-quarters-after-losing-to-borna-coric-1989310-2022-08-18?utm_source=rss "
"373"," Bumrah, Shami will not be with the Indian team forever, have to try and prepare the other guys: Rohit Sharma ","1660795525030","     Bumrah, Shami will not be with the Indian team forever: Rohit Sharma"," https://www.indiatoday.in/sports/cricket/story/bumrah-shami-will-not-be-with-the-indian-team-forever-have-to-try-and-prepare-the-other-guys-rohit-sharma-1989305-2022-08-18?utm_source=rss "
"374"," Zimbabwe vs India 1st ODI, Weather Report: Will rain play a spoilsport in the series opener? ","1660793766030","     ZIM vs IND 1st ODI, Weather Report: Will rain play a spoilsport in the series opener?"," https://www.indiatoday.in/sports/cricket/story/zimbabwe-vs-india-1st-odi-weather-forecast-pitch-report-harare-series-1989295-2022-08-18?utm_source=rss "
"375"," Cincinnati Open: Cameron Norrie completes comeback win over Andy Murray in second-round clash ","1660793289030","     Cincinnati Open: Norrie completes comeback win over Murray in second-round clash"," https://www.indiatoday.in/sports/tennis/story/cincinnati-open-cameron-norrie-completes-comeback-win-over-andy-murray-in-second-round-clash-1989294-2022-08-18?utm_source=rss "
"376"," Zimbabwe vs India, 1st ODI Predicted Playing XI: Rahul Tripathi set for international debut ","1660792207030","     ZIM vs IND, 1st ODI Predicted Playing XI: Rahul Tripathi set for international debut"," https://www.indiatoday.in/sports/cricket/story/zimbabwe-vs-india-predicted-playing-xi-zim-ind-harare-1st-odi-rahul-tripathi-1989290-2022-08-18?utm_source=rss "
"377"," Asia Cup | Pakistan have a history of bringing players back to form: Danish Kaneria wary of Virat Kohli ","1660790955030","     Pakistan have history of bringing players back to form: Kaneria wary of Kohli"," https://www.indiatoday.in/sports/cricket/story/asia-cup-pakistan-have-a-history-of-bringing-players-back-to-form-danish-kaneria-wary-of-virat-kohli-1989285-2022-08-18?utm_source=rss "
"378"," WI vs NZ: Shamarh Brooks stars with bat as West Indies win 1st ODI against New Zealand by five wickets ","1660790103030","     WI vs NZ: Brooks stars with bat as West Indies win 1st ODI by five wickets"," https://www.indiatoday.in/sports/cricket/story/wi-vs-nz-shamarh-brooks-stars-with-bat-as-west-indies-win-1st-odi-against-new-zealand-by-five-wickets-1989281-2022-08-18?utm_source=rss "
"379"," IRE vs AFG: Paul Stirling becomes the 4th batter to score 3000 T20I runs, joins Virat Kohli, Rohit Sharma in elite list ","1660760995030","     IRE vs AFG: Stirling becomes the 4th batter to 3000 T20I runs, joins Kohli, Sharma in elite list"," https://www.indiatoday.in/sports/cricket/story/ire-vs-afg-paul-stirling-becomes-the-4th-batter-to-score-3000-t20i-runs-joins-virat-kohli-rohit-sharma-in-elite-list-1989246-2022-08-17?utm_source=rss "
"380"," T20 World Cup | Whole team is slightly nervous but ready to give 100 percent: Rishabh Pant  ","1660760990030","     T20 World Cup: Whole team is slightly nervous, says Rishabh Pant"," https://www.indiatoday.in/sports/cricket/story/t20-world-cup-whole-team-is-slightly-nervous-but-ready-to-give-100-percent-rishabh-pant-1989245-2022-08-17?utm_source=rss "
"381"," US Open 2022: Venus Williams, Dominic Thiem, Harmony Tan among wildcard entries  ","1660758177030","     US Open 2022: Venus, Thiem, Tan among wildcard entries "," https://www.indiatoday.in/sports/tennis/story/us-open-2022-venus-williams-dominic-thiem-harmony-tan-among-wildcard-entries-1989231-2022-08-17?utm_source=rss "
