"Id","Title","Time","Description","Link"
"1","Rory McIlroy hails Tiger Woods' involvement in PGA Tour discussions on LIV Golf ","1660819382000","Rory McIlroy hailed the influence of ""hero"" Tiger Woods as the 15-time major winner met with fellow PGA Tour players to discuss the controversial Saudi-backed LIV Golf invitational series.","https://www.cnn.com/2022/08/18/sport/rory-mcilroy-tiger-woods-pga-liv-spt-intl/index.html"
"2","Rafael Nadal loses against Borna Ćorić on return from injury","1660814867000",,"https://www.cnn.com/2022/08/18/tennis/rafael-nadal-cincinnati-open-tennis-spt-intl/index.html"
"3","Lebron James becomes highest paid NBA player ever after signing two-year extension with LA Lakers, reports","1660820847000","NBA superstar Lebron James has agreed a two-year extension to his contract with the Los Angeles Lakers on Wednesday, in a deal worth $97.1 million, according to various reports, including ESPN's Adrian Wojnarowski.","https://www.cnn.com/2022/08/18/sport/lebron-james-la-lakers-contract-spt-intl/index.html"
"4","Joe Burrow 'feeling better every day' after surgery for ruptured appendix","1660815284000","Joe Burrow said on Wednesday that he is ""feeling good, feeling better every day"" after undergoing surgery for a ruptured appendix 23 days ago. ","https://www.cnn.com/2022/08/18/sport/joe-burrow-ruptured-appendix-comeback-bengals-spt-intl/index.html"
"5","LIV golfer files defamation lawsuit against Golf Channel and commentator Brandel Chamblee","1660808879000","LIV golfer Patrick Reed filed a defamation lawsuit against the Golf Channel and commentator Brandel Chamblee on Tuesday.","https://www.cnn.com/2022/08/18/sport/liv-golf-patrick-reed-lawsuit-spt-intl/index.html"
"6","ESPN analyst Dick Vitale is cancer free  ","1660813773000","ESPN analyst Dick Vitale is cancer free after lengthy battles with lymphoma and melanoma, he announced Wednesday.","https://www.cnn.com/2022/08/18/sport/dick-vitale-cancer-free-intl-spt/index.html"
"7","NBA won't play games on November 8 to encourage fans to vote in the midterm elections","1660732127000","The NBA will not play games on November 8 in the US this year in order to encourage fans to vote in the midterm elections. ","https://www.cnn.com/2022/08/17/sport/nba-midterm-elections-voting-spt-intl/index.html"
"8","Australian rugby league player banned for placing 'a hand between the buttocks' of an opponent","1660733139000","Australian rugby league player Corey Norman has been given an eight-game suspension and fined £500 (about $605) for ""internationally plac(ing) a hand between the buttocks of an opposing player,"" the Super League announced on Wednesday. ","https://www.cnn.com/2022/08/17/sport/corey-norman-toulouse-rugby-league-ban-spt-intl/index.html"
"9","'Please don't forget about us,' says Ukrainian football legend Andriy Shevchenko","1660648201000","As he urges the world not to forget about those still facing imminent danger from Russian forces, Ukrainian soccer icon Andriy Shevchenko says sport has a major role to play in uniting people behind his country, ","https://www.cnn.com/2022/08/12/football/andriy-shevchenko-ukraine-war-effort-spt-intl/index.html"
"10","Ukrainian tennis star on a 'mission' to help war-torn country ","1660648231000","Ukrainian tennis player Elina Svitolina says she has a ""mission"" to help her country and wants to use her platform to provide hope to the war-torn nation. ","https://www.cnn.com/2022/06/27/tennis/elina-svitolina-ukraine-united-24-spt-intl/index.html"
"11","'This is not saving, this is destruction': Ukrainian MMA champion Yaroslav Amosov recounts the horrors of war","1652790342000","As MMA fighter Yaroslav Amosov walks through the streets surrounding his hometown of Irpin, which sits around 20 kilometers (12.4 miles) west of the Ukrainian capital Kyiv, there are fleeting moments when it seems like an ordinary day in May.","https://www.cnn.com/2022/05/10/sport/yaroslav-amosov-mma-bellator-ukraine-russian-invasion-spt-intl/index.html"
"12","Tennis star Marta Kostyuk asks 'What am I living for?' as Ukrainians grapple with the toll of Russia's invasion","1651319278000",,"https://www.cnn.com/2022/04/29/tennis/marta-kostyuk-tennis-ukraine-russia-spt-intl/index.html"
"13","'It's phenomenal': How remarkable engineering allowed a quadriplegic former NASCAR driver to race again","1660735533000","As racing driver Sam Schmidt tears around the historic Goodwood Racetrack in a McLaren 720S, reaching speeds in excess of 150 miles per hour, from the outside this looks like an ordinary practice session.","https://www.cnn.com/2022/08/17/motorsport/sam-schmidt-arrow-mclaren-sam-car-spt-intl/index.html"
"14","Golfer braced for new life after history-making first major win ","1660223596000",,"https://www.cnn.com/2022/08/11/golf/ashleigh-buhai-womens-british-open-muirfield-spt-intl/index.html"
"15","Why sport stars are wealthier than ever -- but they still may not be getting their fair share","1660079271000","Sometimes, it's tough for the average person to comprehend how much money some professional athletes make. Witness the recent MLB trade deadline. We saw the Washington Nationals trade away Juan Soto after the left fielder turned down a $440 million (!) deal. ","https://www.cnn.com/2022/08/09/sport/major-sport-salaries-nfl-nba-mlb-spt-intl/index.html"
"16","How two mountain bikers produced a stunning feat of skill","1660814378000","Hurtling simultaneously down a dirt-track on a mountain bike may not be everyone's idea of fun, but for Kade Edwards and Brandon Semenuk, it's a chance to push the limits of what's possible on two wheels. ","https://www.cnn.com/2022/08/18/sport/mountain-bikers-parallel-ii-kade-edwards-brandon-semenuk-spt-intl/index.html"
"17","He went viral for playing defense against LeBron James in a pro-am game. But Dion Wright says he was never scared ","1660646010000","Standing room only, fans lined around the block and social media coverage like never before, all there to see one man: a four-time NBA champion and four-time NBA Most Valuable Player. ","https://www.cnn.com/2022/08/16/sport/dion-wright-lebron-james-drew-league-spt-intl/index.html"
"18","Distance runner Hellen Obiri is moving thousands of miles from her home in Kenya to pursue her marathon ambitions","1660645629000","When Hellen Obiri moves 14,000 kilometers from Kenya to Colorado later this year, she already knows she'll miss some of the comforts of home.","https://www.cnn.com/2022/08/10/sport/hellen-obiri-new-york-city-marathon-spt-intl/index.html"
"19","Cameron Smith's No.1 ranking dreams derailed by penalty as Will Zalatoris claims first Tour win at FedEx St Jude Championship","1660563731000","Cameron Smith's hopes of reaching the summit of golf's world rankings were scuppered by a two-shot penalty at the FedEx St. Jude Championship on Sunday.","https://www.cnn.com/2022/08/15/golf/fedex-championship-smith-penalty-zalatoris-spt-intl/index.html"
"20","Rory McIlroy says 'common sense prevailed' in court ruling against players on Saudi-backed LIV Golf series","1660216038000",,"https://www.cnn.com/2022/08/11/golf/rory-mcilroy-liv-golf-pga-tour-ruling-spt-intl/index.html"
"21","1st ODI: Deepak Chahar shines on return as India thump Zimbabwe by 10 wickets","1660830263030","Pacer Deepak Chahar made an impressive comeback to international cricket with an incisive spell and openers maintained their consistency as India outclassed Zimbabwe by 10 wickets in the opening ODI. Donning the blue jersey for the first time in 6 months, Chahar returned figures of 3/27, as India restricting Zimbabwe to a sub-par 189. India then chased down the target with 115 balls to spare.","https://timesofindia.indiatimes.com/sports/cricket/india-vs-zimbabwe-1st-odi-highlights-deepak-chahar-shines-on-return-as-india-thump-zimbabwe-by-10-wickets/articleshow/93643846.cms"
"22","Are you telling me Shikhar Dhawan is not good for T20Is? You can't say that: Kaif","1660828163030","Shikhar Dhawan is in fact a great example. Most IPL teams would be more than happy to have him in their ranks. In the 2020 edition of the IPL Dhawan scored 618 runs, with 2 hundreds and 4 fifties. He had an average of 44.14. In 2021, he scored 587 runs. In this year's edition he scored 460 runs. Overall he has 6244 career IPL runs at an average of over 35. And yet he is not a regular pick in India's T20I teams.","https://timesofindia.indiatimes.com/sports/cricket/news/are-you-telling-me-shikhar-dhawan-is-not-good-for-t20is-you-cant-say-that-mohammad-kaif/articleshow/93642891.cms"
"23","Sometimes in a room full of people who love me, I felt alone: Virat Kohli","1660807148030","Indian cricket superstar Virat Kohli, who took his team to unprecedented heights, says he has struggled with his mental health throughout his career, local media reported on Thursday.","https://timesofindia.indiatimes.com/sports/cricket/news/virat-kohli-opens-up-about-mental-health-struggle/articleshow/93634701.cms"
"24","Deep pockets needed to persuade Glazers to sell Manchester United","1660830095030","British billionaire Jim Ratcliffe's interest in buying Manchester United has raised the hopes of the club's supporters that their American owners, the Glazer family, might now sell the club and pave the way for a return to glory on the field.","https://timesofindia.indiatimes.com/sports/football/epl/top-stories/deep-pockets-needed-to-persuade-glazers-to-sell-manchester-united/articleshow/93643753.cms"
"25","Live: England vs South Africa, 1st Test Day 2","1660722176030","","https://timesofindia.indiatimes.com/sports/cricket/live-cricket-score-updates-england-vs-south-africa-2022-1st-test/liveblog/93612177.cms"
"26","In Pics - Dhawan, Gill lead India to 10-wicket win over Zimbabwe in first ODI","1660830833030","","https://timesofindia.indiatimes.com/sports/cricket/in-pics-shikhar-dhawan-shubman-gill-lead-india-to-10-wicket-win-over-zimbabwe-in-first-odi/photostory/93644035.cms"
"27","SC orders status quo, says HC-appointed CoA will not take over affairs of IOA","1660830957030","In an interim relief, the Supreme Court on Thursday ordered the status quo and said the Delhi High Court-appointed three-member Committee of Administrators (COA) will not take over the affairs of the Indian Olympic Association.","https://timesofindia.indiatimes.com/sports/more-sports/others/sc-orders-status-quo-says-delhi-hc-appointed-coa-will-not-take-over-affairs-of-ioa/articleshow/93644040.cms"
"28","Mohammed Siraj to play Warwickshire's last three County games","1660823336030","India fast bowler Mohammed Siraj will join the English county bandwagon as he gears up to play Warwickshire's last three first-class games in September. Siraj is currently playing the ODI series in Zimbabwe but is not there in India's T20 scheme of things.","https://timesofindia.indiatimes.com/sports/cricket/news/mohammed-siraj-to-play-warwickshires-last-three-county-games/articleshow/93641328.cms"
"29","Chelsea probe alleged racist abuse against Spurs forward Son","1660830854030","Chelsea are investigating after racist abuse was allegedly directed against Tottenham forward Son Heung-min at Stamford Bridge, threatening the ""strongest action"".","https://timesofindia.indiatimes.com/sports/football/epl/top-stories/chelsea-probe-alleged-racist-abuse-against-spurs-forward-son-heung-min/articleshow/93644045.cms"
"30","Live Score: Netherlands vs Pakistan, 2nd ODI","1660811616030","","https://timesofindia.indiatimes.com/sports/cricket/news/live-cricket-score-updates-netherlands-vs-pakistan-2nd-odi/liveblog/93636418.cms"
"31","FIFA sells 2.45 million tickets for Qatar World Cup","1660827561030","Organisers have sold 2.45 million tickets for this year's World Cup in Qatar, world soccer governing body FIFA said on Thursday, with more than half a million of them sold in the last sales period from July 5-16.","https://timesofindia.indiatimes.com/sports/football/top-stories/fifa-sells-2-45-million-tickets-for-qatar-world-cup/articleshow/93643057.cms"
"32","Liverpool's problems dwarfed by Man United's ahead of Old Trafford clash","1660824057030","With four points dropped in their opening two games, Liverpool's margin for error in the expected title race with Manchester City already looks seriously depleted as they prepare for their clash with Manchester United at Old Trafford on Monday.","https://timesofindia.indiatimes.com/sports/football/epl/top-stories/liverpools-problems-dwarfed-by-man-uniteds-ahead-of-old-trafford-clash/articleshow/93641549.cms"
"33","Vingegaard having 'tough time' after Tour de France triumph","1660817873030","Danish cyclist Jonas Vingegaard has been having a ""tough time"" since winning the Tour de France in July, the sporting director of his club Jumbo Visma said Thursday.","https://timesofindia.indiatimes.com/sports/more-sports/cycling/vingegaard-having-tough-time-after-tour-de-france-triumph/articleshow/93638887.cms"
"34","We lost to Pakistan last time, but we're playing differently now: Rohit","1660789393030","With India playing non-stop cricket and the threat of players getting injured or being infected by Covid-19, captain Rohit Sharma stressed that he and coach Rahul Dravid had discussed about ""creating a bench strength,"" considering the amount of cricket the team plays, weighing in the injury factor.","https://timesofindia.indiatimes.com/sports/cricket/asia-cup/team-is-playing-differently-says-rohit-sharma-ahead-of-asia-cup/articleshow/93627271.cms"
"35","Nadal not discouraged by losing on return, says will be ready for US Open","1660809637030","Rafael Nadal was not too downhearted by defeat at the Cincinnati Open on Wednesday after the Spaniard lost 7-6(9) 4-6 6-3 to Borna Coric on his return from a six-week injury layoff.","https://timesofindia.indiatimes.com/sports/tennis/top-stories/rafael-nadal-not-discouraged-by-losing-on-return-says-will-be-ready-for-us-open/articleshow/93635684.cms"
"36","ICC FTP 2023-27: India to play as many as 61 T20Is, will co-host 2026 T20 WC","1660791582030","​The Indian Premier League got bigger last year with the inclusion of two new teams. Now, it's time to get longer as well.","https://timesofindia.indiatimes.com/sports/cricket/news/future-tours-and-programmes-icc-allows-longer-window-for-ipl/articleshow/93628263.cms"
"37","Brooks powers West Indies to 5-wicket win over NZ in 1st ODI","1660792706030","After the home side's bowling combination of pace and spin dismissed the visitors for 190 off 45.2 overs batting first, Brooks's 91-ball 79 with nine fours and one six provided the much-needed solidity to take his team to 193 for five off 39 overs in reply.","https://timesofindia.indiatimes.com/sports/cricket/news/shamarh-brooks-powers-west-indies-to-five-wicket-win-over-new-zealand-in-first-odi/articleshow/93628514.cms"
"38","LeBron James agrees 2-year extension with Lakers for $97 million: Reports","1660794855030","The deal, according to media reports, includes a player option for the 2024-25 season, in which James could see his 17-year-old son Bronny become an NBA rookie.","https://timesofindia.indiatimes.com/sports/more-sports/others/lebron-james-agrees-two-year-extension-with-la-lakers-for-97-million-reports/articleshow/93628954.cms"
"39","Coric crashes Nadal's 'welcome back' party in Cincinnati","1660795808030","Borna Coric spoiled the return of Rafael Nadal after a five-year absence from the ATP and WTA Cincinnati Masters on Wednesday with a 7-6 (11/9), 4-6, 6-3 upset victory in the second round.","https://timesofindia.indiatimes.com/sports/tennis/top-stories/borna-coric-crashes-rafael-nadals-welcome-back-party-in-cincinnati/articleshow/93629205.cms"
"40","Rohit Sharma is a bit laid-back captain, says Sourav Ganguly","1660751735030","BCCI president Sourav Ganguly on Wednesday termed Rohit Sharma a ""laid-back captain"" and said the Mumbaikar should be given some time to produce results.","https://timesofindia.indiatimes.com/sports/cricket/news/rohit-sharma-is-a-bit-laid-back-captain-says-sourav-ganguly/articleshow/93622847.cms"
"41","Kulsum wins feature event ","1660831707000","","https://www.thehindu.com/sport/races/kulsum-wins-feature-event/article65784161.ece"
"42","FIFA ban effect: Kerala Blasters’ pre-season matches in UAE cancelled  ","1660830487000","Special Correspondent","https://www.thehindu.com/sport/kerala-blasters/article65783984.ece"
"43","Mumbai City sails past Indian Navy ","1660830161000","Chhangte nets two as the former ISL champion rallies to win","https://www.thehindu.com/sport/football/mumbai-city-sails-past-indian-navy/article65783757.ece"
"44","Preview | Liverpool&#039;s problems dwarfed by Man United&#039;s ahead of Old Trafford clash ","1660830120000","Liverpool has started the season with two draws, while Manchester United has suffered two losses ahead of their clash at Old Trafford","https://www.thehindu.com/sport/football/preview-liverpools-problems-dwarfed-by-man-uniteds-ahead-of-old-trafford-clash/article65783674.ece"
"45","LeBron James’ new $97-million LA Lakers extension could make him highest-paid player in NBA history ","1660828362000","Four-time NBA MVP LeBron James extends his stay with the Los Angeles Lakers, with whom he won the 2020 NBA championship. The new $97 million deal reportedly makes him the highest-paid player in NBA history","https://www.thehindu.com/sport/other-sports/lebron-james-new-97-million-la-lakers-extension-could-make-him-highest-paid-player-in-nba-history/article65783460.ece"
"46","Eight top weightlifters to train in USA ","1660827485000","Ahead of the World championships in Paris in December","https://www.thehindu.com/sport/weightlifting-training/article65783631.ece"
"47","Chopin, Snowfall and Market King show out ","1660826514000","","https://www.thehindu.com/sport/races/chopin-snowfall-and-market-king-show-out/article65783596.ece"
"48","Gaikwad wins silver; bronze for Mohit, Jaglan ","1660817425000","","https://www.thehindu.com/sport/other-sports/gaikwad-wins-silver-bronze-for-mohit-jaglan/article65782812.ece"
"49","Zimbabwe vs India, 1st ODI | Deepak Chahar shines on return as India wins by 10 wickets ","1660832106000","Prasidh Krishna (3/50) and Axar Patel (3/24) also got their share of victims to restrict Zimbabwe to 189, before openers Shikhar Dhawan (81) and Shubman Gill (82) chased down the target with ease","https://www.thehindu.com/sport/cricket/zimbabwe-vs-india-1st-odi-india-wins-toss-opts-to-bowl-first/article65782400.ece"
"50","Supreme Court orders status quo on Delhi HC’s direction to handover IOA affairs to CoA ","1660829222000","Centre says appointment of CoA might risk India’s ban from Olympics","https://www.thehindu.com/sport/supreme-court-orders-status-quo-delhi-hc-appointed-coa-not-to-take-over-affairs-of-indian-olympic-association/article65782337.ece"
"51","Team India will give its 100% in T20 World Cup, says Rishabh Pant ","1660811485000","Whole team is slightly nervous as the tournament approaches, admits Pant","https://www.thehindu.com/sport/cricket/india-will-give-our-100-in-t20-world-cup-says-rishabh-pant/article65780811.ece"
"52","Domingo primed to deliver in feature event ","1660741523000","","https://www.thehindu.com/sport/domingo-primed-to-deliver-in-feature-event/article65779397.ece"
"53","Ultimate Kho Kho | Gujarat Giants ease past Mumbai Khiladis ","1660756849000","Gujarat Giants began the match with powerplay, activating their two wazirs, Akshay Bhangare and Abhinandhan Patil","https://www.thehindu.com/sport/ultimate-kho-kho-gujarat-giants-ease-past-mumbai-khiladis/article65780762.ece"
"54","South Africa reduce England to 116-6 before rain ends first day ","1660756573000","Kagiso Rabada, who was an injury doubt going into the game, made an excellent start, dismissing both England openers cheaply","https://www.thehindu.com/sport/cricket/south-africa-reduce-england-to-116-6-before-rain-ends-first-day/article65780763.ece"
"55","IND vs ZIM 1st ODI: All eyes on skipper K.L. Rahul as India get ready to steamroll Zimbabwe ","1660817338000","For Zimbabwe, the aim would be to become the proverbial banana peel on which skipper K.L. Rahul and his men can slip ","https://www.thehindu.com/sport/cricket/1st-odi-all-eyes-on-skipper-kl-rahul-as-india-get-ready-to-steamroll-zimbabwe/article65780705.ece"
"56","FIFA ban of AIFF: Stranded in Tashkent, Gokulam Kerala women get 48-hour extension  ","1660811326000","The team is in Uzbekistan to take part in the AFC Women’s Club championship","https://www.thehindu.com/sport/football/fifas-ban-of-aiff-stranded-in-tashkent-gokulam-kerala-women-get-48-hour-extension/article65780500.ece"
"57","Rohit Sharma is laidback, calm and cautious, says Sourav Ganguly ","1660816123000","Ganguly, who is the Board of Control for Cricket in India (BCCI) president, said he never compared captains","https://www.thehindu.com/sport/cricket/i-dont-compare-captains-ganguly/article65780526.ece"
"58","Cristiano Ronaldo says truth will be revealed over Manchester United future soon   ","1660819401000","“The media is telling lies. I have a notebook and in the last few months of the 100 news (stories) I made, only five were right,” Cristiano Ronaldo wrote on Instagram of the transfer rumours","https://www.thehindu.com/sport/football/cristiano-ronaldo-says-truth-will-be-revealed-over-manchester-united-future-soon/article65780528.ece"
"59","With two personal coaches from Indonesia, Bharath aims for the sky ","1660752534000","The youngster gets a chance to train with Olympic champion Axelsen now and then","https://www.thehindu.com/sport/other-sports/with-two-personal-coaches-from-indonesia-bharath-aims-for-the-sky/article65778914.ece"
"60","BFC gets the better of Jamshedpur ","1660751835000","Odisha runs riot against NorthEast United","https://www.thehindu.com/sport/bfc-gets-the-better-of-jamshedpur/article65779533.ece"
"61","Riske-Amritraj headlines Chennai Open entry list ","1660748173000","The inaugural WTA 250 event in the city will run from September 12 to 18","https://www.thehindu.com/sport/tennis/riske-amritraj-headlines-chennai-open-entry-list/article65779902.ece"
"62","Hosting of men’s World Cup on track ","1660747616000","Hockey India election process to be completed by October 9","https://www.thehindu.com/sport/hockey/hosting-of-mens-world-cup-on-track/article65779763.ece"
"63","England v South Africa: first Test, day two – live!","1660831458000","Live updates from the second day of five at Lord’sThe Spin: sign up for our weekly cricket newsletterThe players are out there and so is the sun. Ollie Pope, England’s lone star of the game so far, is ready to face the first ball from Kagiso Rabada.Back in the real world, Andrew Strauss and his sons Sam and Luca are on the field to mark Red For Ruth day. Andrew is in his red suit, like a dad going to a teenage party as The Joker. Sam and Luca are in red T-shirts and red bucket hats, like two kids at a festival. What he lacks in terms of hair, they more than make up with the sort of fluffy long-at-the-front look that you would have seen on the cover of Smash Hits in 1983. Continue reading...","https://www.theguardian.com/sport/live/2022/aug/18/england-v-south-africa-first-test-day-two-live-score-updates-cricket"
"64","Arsenal’s fast start is no accident: it is a reward for planning and patience | Karen Carney","1660816843000","Fixture list may have been kind but Mikel Arteta has rebuilt the culture and the squad to look ready for a return to the top levelMikel Arteta has been given the time required to shape a squad over two and a half years. Everyone wants a quick fix in football but sometimes changing a club’s strategy takes time and Arsenal could be about to reap the rewards. We are only two games into the new Premier League season so no one should get too carried away with six points against Crystal Palace and Leicester but the signs are promising. The victories have set the platform for a great start to the campaign, especially with winnable matches against Bournemouth, Fulham and Aston Villa before the month ends. If they get maximum points it will help build momentum and confidence, two incredibly important traits.Arsenal have had another successful window this summer, adding players with experience of winning the Premier League. Gabriel Jesus and Oleksandr Zinchenko know what it is like to fight at the top of the league and can lead the team to reach higher levels. Managers always want to add winners to the dressing room, they’re resilient. Arteta signed two players he worked with previously at Manchester City; his methods are not identical to Pep Guardiola’s but they are of the same ilk so both will know what is wanted from them. It was a smooth transition for Zinchenko and Jesus and both wanted to play in this type of football environment. Continue reading...","https://www.theguardian.com/football/blog/2022/aug/18/arsenal-fast-start-planning-patience-mikel-arteta"
"65","Rampant Emma Raducanu races past Victoria Azarenka in Cincinnati","1660769256000","British No 1 beats former grand slam title winner 6-0, 6-2Raducanu defeated Serena Williams in previous roundAs Emma Raducanu wrapped up her media obligations close to 10pm on Tuesday night, still digesting all of the wondrous moments she had experienced that evening, she faced another one of the learning experiences that have characterised her past year.After the euphoria and adrenaline of snuffing out Serena Williams before her thunderous home crowd, Raducanu was charged with forgetting it all and quickly moving on, another former No 1 to come. Continue reading...","https://www.theguardian.com/sport/2022/aug/17/rampant-emma-raducanu-races-past-victoria-azarenka-in-cincinnati"
