"Id","Title","Time","Description","Link"
"345","US Court Says Elon Musk's Responses To Twitter Lawsuit To Be Made Public","1659617266030","Twitter and Musk are going to battle it out in the courtroom with their case hearing starting on October 17 when the protracted $44 billion deal will be contested.","https://www.news18.com/news/tech/us-court-says-elon-musks-responses-to-twitter-lawsuit-to-be-made-public-5688853.html"
"346","WhatsApp Secretly Extends Time Limit To Delete Messages For Everyone; You Can Now Delete Over 2-Day Old Texts","1659612719030","The ability to delete more than two-day old messages has been in beta since some time for WhatsApp.","https://www.news18.com/news/tech/whatsapp-secretly-extends-time-limit-to-delete-messages-for-everyone-you-can-now-delete-over-2-day-old-texts-5688145.html"
"347","OnePlus Launches OxygenOS 13: All Your Questions Answered About Next OnePlus UI","1659599137030","OnePlus 8 and newer flagships will get the OxygenOS 13 update, while in the OnePlus Nord series, OnePlus Nord 2 and newer devices are eligible for the OxygenOS 13 update.","https://www.news18.com/news/tech/oneplus-launches-oxygenos-13-all-your-questions-answered-about-next-oneplus-ui-5686297.html"
"348","Setting Up Future-Ready India With 5G Roadmap: The Possibilities & Challenges","1659597866030","With the spectrum auction right around the corner on July 26, let’s evaluate what possibilities and challenges the nationwide 5G rollout will bring to India.","https://www.news18.com/news/tech/setting-up-future-ready-india-with-5g-roadmap-the-possibilities-challenges-5686105.html"
"349","Apple May Delay iPadOS 16 Launch Till October: Here's Why","1659594875030","iPadOS 16 was announced back in June during the Apple Worldwide Developer Conference (WWDC) 2022 alongside iOS 16, macOS Ventura, WatchOS 9, and other Apple software announcements.","https://www.news18.com/news/tech/apple-may-delay-ipados-16-launch-till-october-heres-why-5685787.html"
"350","Battlegrounds Mobile India Banned: Best Games You Can Play As Alternatives On Android And iOS","1659592111030","Battlegrounds Mobile India has been delisted from the Google Play Store and the Apple App Store reportedly after a government order. ","https://www.news18.com/news/tech/battlegrounds-mobile-india-banned-best-alternatives-that-you-can-play-on-your-android-ios-device-5685379.html"
"351","Asus Launches New Vivobook S14 Flip, Zenbook 14 Flip OLED And More Laptops In India: Price, Specs And More","1659588168030","The new laptops will be available for purchase online at Asus' e-shop, Amazon and Flipkart.","https://www.news18.com/news/tech/asus-launches-new-vivobook-s14-flip-zenbook-14-flip-oled-and-more-laptops-in-india-price-specs-and-more-5684959.html"
"352","Amazon Ties Up With Indian Railways to Boost Delivery of Packages in Over 110 Inter-city Routes","1659585421030","Since its operational engagement with the Indian Railways in 2019, Amazon has increased its transportation lanes five fold, the e-retail giant said","https://www.news18.com/news/auto/amazon-ties-up-with-indian-railways-to-boost-delivery-of-packages-in-over-110-inter-city-routes-5684749.html"
"353","OnePlus 10T vs iQoo 9T 5G: How Latest Android Flagships Compare Against Each Other","1659584415030","The OnePlus 10T 5G and the iQoo 9T 5G both start at a price of Rs 49,999 in India. Here's how they fare against each other on paper.","https://www.news18.com/news/tech/oneplus-10t-vs-iqoo-9t-5g-how-latest-android-flagships-compare-against-each-other-5684503.html"
"354","BGMI Ban Fuels Concerns over e-Sports' Future in India, Experts Highlight Next Possible Play","1659583837030","Online gaming industry experts believe that the e-Sports sector in India has a massive scope to grow in the coming years","https://www.news18.com/news/tech/bgmi-ban-fuels-concerns-over-e-sports-future-in-india-experts-highlight-next-possible-play-5682013.html"
"355","OnePlus 10T 5G Launched In India Rs 49,999: All Details, Availability And More","1659542032030","OnePlus 10T 5G smartphone launched in India at a price of Rs 49,999. The OnePlus 10T 5G smartphone will go on sale in India starting August 6, 2022. All details and OnePlus 10T unboxing video here. ","https://www.news18.com/news/tech/oneplus-10t-5g-smartphone-with-snapdragon-8-gen-1-chipset-150w-charging-debuts-in-india-price-specifications-5683411.html"
"356","Top Tech News - August 3: OnePlus China Event Cancelled, Apple Security Warning And More","1659539193030","Today's Top Tech News edition covers Apple security risk, Motorola event cancelled and Xiaomi's AR glasses.","https://www.news18.com/news/tech/top-tech-news-august-3-oneplus-china-event-cancelled-apple-security-warning-and-more-5681575.html"
"357","How to Pre-Order PS5 Horizon Forbidden West Bundles in August 22 Restock","1661144409000","PS5 India August 22 restock - for Rs. 53,990 PS5 Horizon Forbidden West bundle, and Rs. 43,990 PS5 Digital Edition HFW bundle - is available at Amazon, Croma, Flipkart, Game Loot, Games The Shop,...","https://gadgets360.com/games/news/ps5-india-buy-price-restock-horizon-forbidden-west-amazon-flipkart-croma-reliance-digital-playstation-5-bundle-3274561"
"358","Mobile Internet Services Suspended in 25 Assam Districts During Exams","1661143535000","Mobile internet services in 25 districts of Assam were suspended for on Sunday while the state government conducted Grade IV exams across various departments, while prohibitory orders under Section...","https://gadgets360.com/telecom/news/assam-mobile-internet-services-suspended-government-exam-malpractices-3274528"
"359","Watch The Last of Us TV Series Trailer, Starring Pedro Pascal","1661142548000","HBO has unveiled a teaser for The Last of Us TV series, ahead of its release in 2023. The Last of Us is based on the critically acclaimed video game of the same name, and stars Pedro Pascal and Bella...","https://gadgets360.com/entertainment/news/last-of-us-tv-series-trailer-release-date-cast-characters-pedro-pascal-hbo-max-tease-3274498"
"360","Pegasus Maker NSO Group CEO Resigns Ahead of Reorganisation","1661142243000","Pegasus spyware creator NSO Group on Sunday announced that its CEO Shalev Hulio had resigned, while the company would cut 100 jobs ahead of a restructuring effort. Chief Operating Officer Yaron Shohat...","https://gadgets360.com/mobiles/news/nso-group-ceo-shalev-hulio-resigns-3274485"
"361","House of the Dragon Episode 1 Leaked on Torrents Ahead of Release","1661082073000","House of the Dragon episode 1 leaked on torrents and available for download via piracy networks. House of the Dragon episode 1 releases August 22 at 6:30am IST on Disney+ Hotstar in India. House of...","https://gadgets360.com/entertainment/news/house-dragon-episode-1-download-torrent-leaked-piracy-watch-release-time-hotstar-3273194"
"362","Everything You Need to Know About Saints Row: Release Date, Size","1661052601000","Saints Row releases on August 23 in India across PS4, PS5, Xbox One, Xbox Series S/X, and PC via Epic Games Store. Deep Silver's reboot of the street crime franchise puts you in the fictional city...","https://gadgets360.com/games/news/saints-row-2022-release-date-system-requirements-gameplay-size-price-ps4-ps5-xbox-3270127"
"363","Global Warming Triggered Reptile Boom Millions of Years Ago: Says Study","1661002756000","A new study indicates that global warming, rather than mass extinction was behind a boom in reptile population and diversity. Researchers, from the Department of Organismic and Evolutionary Biology...","https://gadgets360.com/science/news/global-warming-behind-reptile-population-explosion-250-million-years-ago-study-suggests-3271371"
"364","Scientists Create High-Resolution Map of Developing Cerebral Cortex","1660999945000","Scientists have successfully mapped the surface of the cerebral cortex of the young human brain in impressively high resolution. The mapping, done using high-quality magnetic resonance imaging (MRI)...","https://gadgets360.com/science/news/cerebral-cortex-map-offers-insights-into-brain-development-3271250"
"365","Xiaomi NoteBook Pro 120G, Smart TV X Series to Debut in India on August 30: Details","1660999372000","Xiaomi will launch two new products on August 30 in India. The Chinese company will unveil the Xiaomi NoteBook Pro 120G and Smart TV X Series. The upcoming smart TV could feature a display with 4K...","https://gadgets360.com/laptops/news/xiaomi-notebook-pro-120g-smart-tv-x-launch-date-august-30-specifications-features-india-3271321"
"366","Facebook to Release Major Updates to Horizon Worlds: Zuckerberg","1660995790000","Meta's Mark Zuckerberg has shared online that the company will be releasing major updates to the Horizon Worlds and its avatar graphics soon. The announcement comes days after the company launched...","https://gadgets360.com/apps/news/facebook-horizon-worlds-major-updates-release-soon-avatar-graphics-meta-metaverse-3271200"
"367","Researcher Makes Shocking Claims About iPhone Apps Of Meta, Instagram","1660993163000","A security researcher has made some serious allegations against Meta (previously known as Facebook), Instagram and TikTok, saying their iPhone applications may be capable of tracking everything users...","https://gadgets360.com/tablets/news/researcher-makes-shocking-claims-about-iphone-apps-of-meta-instagram-and-tiktok-3271092"
"368","Google Wear OS May Get Smartwatch Backup Support: Report","1660992031000","New strings in the beta version 22.32.12 build of the Google Play Services app revealed that the company is reportedly preparing to add support for backing up smartwatch data on Wear OS when switching...","https://gadgets360.com/wearables/news/google-wear-os-smartwatch-backup-support-apk-teardown-3271047"
"369","WhatsApp Beta Gets Ability to View Status Updates in Chat List: Report","1660989523000","WhatsApp beta for Android version 2.22.18.17 adds ability for some beta testers to view the status updates within the chat history. This features was reportedly under development earlier. Although,...","https://gadgets360.com/apps/news/whatsapp-beta-android-feature-view-status-updates-chat-list-testers-3270944"
"370","Astronomers Spot Gigantic Black Hole Jet Measuring Million Light-Years Across","1660987941000","Astronomers, observing a nearby galaxy with a powerful telescope, have detected one of the largest black hole jets ever. The jet with a size of a million light-years from end to end is not just huge...","https://gadgets360.com/science/news/black-hole-jets-largest-million-light-years-across-spotted-3270752"
"371","Asteroid Ryugu Sample Has Dust Grains Older Than Our Solar System","1660985883000","Examining samples from asteroid Ryugu, scientists have made a startling discovery. They have spotted microscopic grains of ancient materials that are even older than our Solar System. Located in the...","https://gadgets360.com/science/news/asteroid-ryugu-ancient-grains-older-than-our-solar-system-3270596"
"372","Motorola Website Reveals Names of 10 Phones to Get Android 13: Details","1660984963000","Motorola's official website has listed 10 smartphones that will get the Android 13 update. Four Moto Edge series handsets and six Moto G series phones have been listed. The company is yet to...","https://gadgets360.com/mobiles/news/moto-edge-30-pro-g-series-android-13-update-release-confirmed-motorola-3270756"
"373","Diljit Dosanjh's Upcoming Thriller 'Jogi' Teaser Out Now","1660982369000","Makers of the upcoming period emotional thriller film Jogi, on Saturday, unveiled the teaser of the film. Taking to Instagram, Netflix dropped the teaser, which they captioned, ""Dekhiye Jogi ka...","https://gadgets360.com/entertainment/news/diljit-dosanjh-jogi-teaser-netflix-release-date-september-16-3270664"
"374","Mumbai Traffic Police Said to Have Received Terror Attack Text on WhatsApp","1660979696000","Mumbai Police is said to be investigating a WhatsApp message warning of a ""26/11-like"" terror attack in the city received on the WhatsApp number of the Mumbai Police Traffic Control from a...","https://gadgets360.com/apps/news/whatsapp-message-26-11-terror-attack-mumbai-traffic-police-investigating-3270571"
"375","Foxconn to Reportedly Invest $300 Million More in Northern Vietnam","1660977242000","Apple supplier Foxconn has reportedly signed a $300 million (roughly Rs. 2,400 crore) memorandum of understanding with Vietnamese developer Kinh Bac City to expand its facility in the north of the...","https://gadgets360.com/mobiles/news/apple-foxconn-invest-usd-300-million-northern-vietnam-expand-facility-3270482"
"376","Google Pixel 7 Series Alleged Hands-On Video Shared Online: Details","1660976081000","Google Pixel 7 and Pixel 7 Pro hands-on video of the early developer versions has been shared via YouTube. The video suggests some hardware specifications of the upcoming Google Pixel 7 series...","https://gadgets360.com/mobiles/news/google-pixel-7-pro-hands-on-alleged-early-developer-version-specifications-features-3270444"
"377","FTX grew revenue 1,000% during the crypto craze, leaked financials show","1661026206000","FTX rode the crypto craze to a billion dollars in revenue last year while expanding its global footprint, according to internal documents seen by CNBC.","https://www.cnbc.com/2022/08/20/ftx-grew-revenue-1000percent-during-the-crypto-craze-leaked-financials.html"
"378","Once high-flying Chinese tech giants are now looking to scale back costs","1661129756000","Alibaba and Tencent have felt the effects of a Covid-induced economic slowdown in China which is hitting areas from consumer spending to advertising budgets. ","https://www.cnbc.com/2022/08/22/chinas-alibaba-and-tencent-focus-on-cost-cuts-amid-slowing-growth.html"
"379","Elon Musk says Tesla will hike the price of FSD driver assistance software by 25% in September","1661106612000","Elon Musk said on Sunday that Tesla plans a price increase for FSD, its premium driver assistance option.","https://www.cnbc.com/2022/08/21/elon-musk-says-tesla-will-raise-price-of-fsd-by-25percent-in-september.html"
"380","Disney CEO Bob Chapek again distances himself from Bob Iger with Disney+ pricing decision","1661079601000","Bob Chapek's decision to boost Disney+ pricing 38% runs counter to predecessor Bob Iger's pricing strategy.","https://www.cnbc.com/2022/08/21/disney-chapek-iger-disney-plus-price-decision.html"
"381","YouTube removes video by Tesla investors using kids in FSD Beta test","1660969415000","The tests were to determine if a slow-moving Tesla equipped with the company's latest driver assistance systems would automatically avoid pedestrians.","https://www.cnbc.com/2022/08/19/youtube-removes-video-by-tesla-investors-using-kids-in-fsd-beta-test.html"
"382","Delta, the NFL, and the U.S. Air Force are turning to this app to prepare for extreme weather","1660937209000","Tomorrow.io aims to tell customers how extreme weather will affect them while there's still time to prepare.","https://www.cnbc.com/2022/08/19/delta-nfl-air-force-use-tomorrowio-to-prepare-for-extreme-weather.html"
"383","Crypto firm FTX gets warning from FDIC to stop 'misleading' consumers about deposit protection","1660938622000","The FDIC issued letters to five crypto companies on Friday demanding that they stop making false claims about deposit insurance. ","https://www.cnbc.com/2022/08/19/crypto-firm-ftx-receives-cease-and-desist-from-fdic-about-insurance.html"
"384","Ether is up 100% since its bottom in June, massively outperforming bitcoin","1660870089000","Since finding a bottom in mid-June, ether is up 106% and bitcoin is 31% higher as investors anticipate a major upgrade to the ethereum blockchain.","https://www.cnbc.com/2022/08/19/ether-eth-price-outpaces-bitcoin-btc-as-ethereum-merge-nears.html"
"385","Sudden crypto market drop sends bitcoin below $22,000","1660941903000","Bitcoin hit a three-week low as cryptocurrencies rapidly plunged in early Friday trading.","https://www.cnbc.com/2022/08/19/sudden-crypto-market-drop-sends-bitcoin-below-22000.html"
"386","Here's why HBO Max is pulling dozens of films and TV series from the streaming platform","1660926842000","HBO Max is pulling 36 TV shows and movies to cut costs and shift its strategy.","https://www.cnbc.com/2022/08/19/heres-why-hbo-max-is-pulling-dozens-of-films-and-tv-series-from-its-streaming-platform.html"
"387","Musk approaches brain chip startup Synchron about deal amid Neuralink delays, sources say","1660934210000","Musk reached out to Synchron's founder and chief executive, Thomas Oxley, in recent weeks to discuss a potential deal, the sources said.","https://www.cnbc.com/2022/08/19/musk-approaches-brain-chip-startup-synchron-about-deal-amid-neuralink-delays-sources-say-.html"
"388","KeyBanc raises price target on Apple, citing healthy iPhone demand","1660913198000","KeyBanc's new price target implies 6% upside from Thursday's close.","https://www.cnbc.com/2022/08/19/keybanc-raises-price-target-on-apple-citing-healthy-iphone-demand.html"
"389","Amazon's 'Thursday Night Football' begins a new era of streaming for the NFL","1661026529000","Amazon is developing new broadcast technology for ""Thursday Night Football"" to win over fans while also preparing for initial frustration.","https://www.cnbc.com/2022/08/19/amazon-thursday-night-football-new-era-nfl-streaming.html"
"390","How WhatsApp grew from near-failed app to Meta's next monetization push","1660936295000","Push notifications changed everyone for WhatsApp, taking what looked like a failed app idea to what is now the most used communications app in the world.","https://www.cnbc.com/2022/08/18/how-whatsapp-grew-from-near-failed-app-to-metas-next-monetization-push.html"
"391","Google workers demand equal abortion benefits as state bans go into effect","1660844092000","It comes as abortion bans start to go into effect in some states.","https://www.cnbc.com/2022/08/18/google-workers-petition-management-for-equal-abortion-benefits.html"
"392","Soon you'll be able to edit and unsend iMessages on iPhone. Here's how it works","1660870149000","Apple's new iOS 16 iPhone software, expected in September, will let you edit and unsend text messages for the first time. Here's how it works.","https://www.cnbc.com/2022/08/18/how-to-edit-or-unsend-an-imessage-on-iphone.html"
"393","Snap stops development of Pixy flying camera drone in latest blow to hardware efforts","1660955264000","Snap is pausing all future development of Pixy, its $230 flying camera drone that was first announced in April.","https://www.cnbc.com/2022/08/18/snap-stops-development-of-pixy-flying-camera-drone-.html"
"394","Cisco shares rally the most in nearly two years after earnings beat","1660855679000","Shares of Cisco jumped about 6% on Thursday, their biggest gain since November 2020.","https://www.cnbc.com/2022/08/18/cisco-shares-on-track-for-best-day-since-2020-after-q4-earnings-beat.html"
"395","A-Rod and Marc Lore invested in this startup trying to make fusion with insanely powerful lasers","1660922127000","With investment from Yankee slugger A-Rod and a former Wal-Mart president, among others, Focused Energy is a fusion startup stacked with industry veterans. ","https://www.cnbc.com/2022/08/18/focused-energy-fusion-industry-veterans-bet-on-insanely-strong-lasers.html"
"396","Swedish entertainment company buys rights to 'Lord of the Rings' films and other Tolkien intellectual property","1660836890000","Embracer Group has bought the rights to some Tolkien intellectual property, including movies, video games and theme parks.","https://www.cnbc.com/2022/08/18/embracer-group-buys-rights-to-lord-of-the-rings-and-tolkien-related-intellectual-property.html"
"397","Asset managers on alert after 'WhatsApp' crackdown on banks","1660825226000","Asset managers are tightening controls on personal communication tools such as WhatsApp to ensure employees play by the rules when they do business remotely.","https://www.cnbc.com/2022/08/18/asset-managers-on-alert-after-whatsapp-crackdown-on-banks.html"
"398","Cisco tops estimates on revenue and profit and gives optimistic annual sales forecast","1660775706000","Cisco said revenue will grow by about 5% in the new fiscal year, accelerating from 3% in the year that just ended","https://www.cnbc.com/2022/08/17/cisco-csco-earnings-q4-2022.html"
"399","As gaming sales slump, China's Tencent signals a hot ad trend it's betting on","1660797644000","Tencent said advertising in its nascent short video platform could become a ""substantial"" revenue source as other areas of its business face pressure. ","https://www.cnbc.com/2022/08/18/tencent-looks-to-short-video-ads-to-boost-revenue-amid-gaming-slump.html"
"400","Apple and Meta headsets could face a big challenge: Sticker shock","1660705485000","Apple and Meta are developing technology for mixed reality that requires a lot of expensive parts and a powerful headset.","https://www.cnbc.com/2022/08/16/apple-and-meta-mixed-reality-headsets-sticker-shock.html"
"401","Crypto broker Genesis slashes 20% of workforce and announces CEO exit after loans soured","1660829822000","Genesis CEO Michael Moro is leaving and the company is cutting jobs after losing money from loans to bankrupt hedge fund Three Arrows Capital.","https://www.cnbc.com/2022/08/17/crypto-broker-genesis-slashes-20percent-of-workforce-and-announces-ceo-exit-.html"
"402","'Flash' star Ezra Miller's apology is not a get-out-of-jail-free card, experts say","1660775000000","Ezra Miller has apologized and announced they are undergoing mental health treatment as Warner Bros. grapples with how to handle the release of ""The Flash.""","https://www.cnbc.com/2022/08/17/flash-star-ezra-miller-apology-not-enough.html"
"403","Apple reportedly in talks to make Apple Watches and MacBooks in Vietnam","1660783641000"," Apple is reportedly in talks to produce some of its Apple Watches and MacBooks in Vietnam","https://www.cnbc.com/2022/08/17/apple-reportedly-in-talks-to-make-apple-watches-macbooks-in-vietnam-.html"
"404","Fiber optic technology powers the internet, and it's a big business","1660946898000","Fiber connections are known to provide fast, reliable internet. But many Americans still don't have access. New government investments could change that. ","https://www.cnbc.com/2022/08/17/fiber-optic-technology-powers-the-internet-and-its-a-big-business.html"
"405","Tencent, the $370 billion Chinese tech giant, posts first ever revenue decline","1660740497000","Tencent posted its first ever quarterly year-on-year revenue decline as stricter regulations around gaming in China and a resurgence of Covid hit the tech giant.","https://www.cnbc.com/2022/08/17/tencent-earnings-q2-chinese-tech-giant-posts-first-ever-revenue-decline.html"
"406","Manchester United shares briefly pop 17% in premarket after Elon Musk jokes about buying the club","1660735544000","Shares of the English soccer club Manchester United Plc briefly rose by as much as 17% in premarket trading on Wednesday.","https://www.cnbc.com/2022/08/17/manchester-united-shares-rise-after-elon-musk-jokes-about-buying-the-club.html"
"407","In a first, OTT streaming surpasses cable TV, captures largest share of TV viewing: Nielsen","1661147569000","","https://indianexpress.com/article/technology/tech-news-technology/in-a-first-ott-streaming-surpasses-cable-tv-captures-largest-share-of-tv-viewing-nielsen-8104298/"
"408","Shazam turns 20: This hidden feature can recognise any song using your iPhone","1661146962000","","https://indianexpress.com/article/technology/techook/shazam-turns-20-this-hidden-feature-can-recognise-any-song-using-your-iphone-8104084/"
"409","Tasmanian tigers, mammoths: Are de-extinction projects human vanity?","1661146518000","","https://indianexpress.com/article/technology/science/tasmanian-tiger-mammoth-dodo-de-extinction-8104282/"
"410","NASA’s Ingenuity Mars Helicopter turns ‘winter warrior’ for next flight","1661145315000","","https://indianexpress.com/article/technology/science/ingenuity-mars-helicopter-martian-winter-flight-30-8104240/"
"411","A dad took photos of his naked toddler for the doctor. Google flagged him as a criminal","1661142842000","","https://indianexpress.com/article/technology/tech-news-technology/bc-r-google-child-pictures-abridged-art-nyt-8104178/"
"412","UPI transactions to attract charges? Finance Ministry issues clarifications, everything to note","1661142564000","","https://indianexpress.com/article/technology/tech-news-technology/upi-payment-fees-rbi-charges-no-charges-finance-ministry-issues-clarifications-everything-to-know-8104177/"
"413","Israeli spyware company NSO Group CEO steps down","1661141074000","","https://indianexpress.com/article/technology/tech-news-technology/israeli-spyware-nso-group-ceo-pegasus-software-8104135/"
"414","India’s first Hydrogen fuel cell bus: What is hydrogen fuel cell technology?","1661140015000","","https://indianexpress.com/article/technology/science/hydrogen-fuel-cell-electric-bus-8104087/"
"415","iPhone 14 to AirPods Pro 2: What you should expect from Apple’s September event","1661084619000","","https://indianexpress.com/article/technology/tech-news-technology/apple-event-september-7-iphone-14-airpods-pro-2-8103384/"
"416","Space news weekly recap: Artemis program, colliding black holes and more","1661072534000","","https://indianexpress.com/article/technology/science/space-news-weekly-recap-nasa-artemis-moon-black-hole-cosmonaut-8102993/"
"417","Jetpack Joyride 2 review: Familiar, but still a lot of fun","1661063678000","","https://indianexpress.com/article/technology/gaming/jetpack-joyride-2-review-apple-arcade-8102563/"
"418","NASA selects potential regions to land crew for Artemis III mission","1661060504000","","https://indianexpress.com/article/technology/science/nasa-artemis-iii-crewed-moon-mission-landing-region-site-8102629/"
