"Id","Title","Time","Description","Link"
"116","OnePlus 10T review: this phone fully charges in 19 minutes","1659938406000","Lightning-quick recharging could be game-changing for cut-price Android with top performanceOnePlus is back with another mid-cycle upgrade to its top Android phone – this time with the lightning-fast-charging 10T handset, which can fully power up in under 20 minutes without destroying its battery life.After a two-year hiatus, the “T” series of phones is back to debut new technology halfway through the year, this time with 150W charging – more than five times the power of Apple’s top iPhone.Screen: 6.5in 120Hz FHD+ OLED (393ppi)Processor: Qualcomm Snapdragon 8+ Gen 1RAM: 8 or 16GB of RAMStorage: 128 or 256GBOperating system: OxygenOS 12.1 (Android 12)Camera: 50MP main, 8MP ultrawide, 2MP macro; 16MP selfieConnectivity: 5G, eSIM, wifi 6, NFC, Bluetooth 5.3 and GNSSWater resistance: NoneDimensions: 163 × 75.4 × 8.8mmWeight: 203.5g Continue reading...","https://www.theguardian.com/technology/2022/aug/08/oneplus-10t-android-review-this-phone-fully-charges-in-19-minutes"
"117","Nothing Phone 1 review: an Android with funky lights on its transparent back","1659592800000","Novel design, good cameras, solid performance and battery life make a competitively priced packageThe Phone 1 is the first smartphone from the British technology startup Nothing, led by the OnePlus co-founder Carl Pei, who set up on his own with the aim of bringing back a bit of interest and excitement to the increasingly samey world of consumer electronics.But the firm’s follow-up to the funky Ear 1 earbuds is no flashy top-spec phone. Priced at £399 (A$749), it looks to compete directly with more affordable models such as Samsung’s mid-range A-series and Google’s Pixel 6a. It does so while offering something unique: a series of white LED strips strewn across a transparent glass back to create patterns of light that Nothing calls “glyphs”. Continue reading...","https://www.theguardian.com/technology/2022/aug/04/nothing-phone-1-review-an-android-with-funky-lights-on-its-transparent-back-cameras-battery"
"118","Google Pixel 6a review: this mid-range master is a true bargain","1658469605000","Top chip, brilliant camera, great software and solid battery life in a smaller body with a cheaper priceThe Pixel 6a is Google’s latest mid-range smartphone offering the same chips and performance as its top phones, but in a new, smaller body for a cheaper price.The phone costs £399 ($449/A$749), which is £200 less than the Pixel 6, but offers 80% of what you get with Google’s top models.Screen: 6.1in 60Hz FHD+ OLED (429ppi)Processor: Google TensorRAM: 6GBStorage: 128GBOperating system: Android 12Camera: 12.2MP + 12MP ultrawide, 8MP selfieConnectivity: 5G, eSIM, wifi 6E, NFC, Bluetooth 5.2 and GNSSWater resistance: IP67 (1m for 30 minutes)Dimensions: 152.2 x 71.8 x 8.9mmWeight: 178g Continue reading...","https://www.theguardian.com/technology/2022/jul/22/google-pixel-6a-review-this-mid-range-master-is-a-true-bargain"
"119","Mobile deals: how to buy a smartphone for less","1656309605000","They are essential tools but can be expensive. From trade-ins to refurb there are ways to get a better dealPrices for the same model regularly fluctuate between retailers. While manufacturers typically only sell their phones at the recommended retail price, third-party retailers can discount them depending on stock levels and age, so shop around and check multiple price comparison tools such as Google Shopping, Kelkoo, PriceRunner or Price Spy. Continue reading...","https://www.theguardian.com/money/2022/jun/27/mobile-deals-buy-a-smartphone-for-less"
"120","Sennheiser Momentum 4 review: tremendous noise-cancelling headphones","1661148031000","Supremely comfortable, feature-packed Bluetooth cans sound brilliant with 60-hour battery lifeThe fourth-generation of the Momentum Bluetooth headphones from the renowned German audio manufacturer Sennheiser are a wholesale redesign, ditching their previous retro styling for something simpler and much more comfortable. All this with 60-hours of battery life.Undeniably pricey at £299 ($349.99/A$549.99), the Momentum 4 Wireless are still £50 cheaper than their predecessors and undercut key competitors from Sony, Bose and Apple. Continue reading...","https://www.theguardian.com/technology/2022/aug/22/sennheiser-momentum-4-review-tremendous-noise-cancelling-headphones-bluetooth-battery"
"121","Apple MacBook Air M2 review: sleek redesign takes things up a notch","1660543231000","Upgrade gets a bigger screen in a lighter, thinner body, plus rapid new M2 chip with tremendous battery lifeApple’s popular MacBook Air has been give its biggest redesign since it was first introduced in 2008, ditching its classic wedge shape and making it thinner, with a bigger screen and better than ever for 2022.The revamped laptop builds on the internal changes made with the gamechanging M1 model in 2020, introducing Apple’s next-generation M2 chip in a sleeker flat aluminium body. Continue reading...","https://www.theguardian.com/technology/2022/aug/15/apple-macbook-air-m2-review-chip-battery"
"122","Pixel Buds Pro review: Google’s great AirPods Pro rival for Android","1659420044000","New and improved earbuds sound better, have noise cancelling, last longer and are very comfortableGoogle’s latest Pixel Buds earbuds have been given the “pro” treatment, with better sound, noise cancelling, multipoint Bluetooth and a comfier design aimed at rivalling Apple’s AirPods Pro but for Android users.The Pixel Buds Pro cost £179 ($199/A$299), sitting above the firm’s £100 Pixel Buds A-Series as Google’s new top model. They will work with any standard Bluetooth device, including PCs and iPhones, but have special features designed for Android. Continue reading...","https://www.theguardian.com/technology/2022/aug/02/pixel-buds-pro-review-google-apple-airpods-android"
"123","Garmin Forerunner 255 review: runner’s best friend gets GPS and multisport upgrade","1657519207000","Greater accuracy, longer battery and full support for triathlons makes the best running watch even betterGarmin’s latest running watch has been upgraded in almost every way, bringing multisport tracking, more advanced GPS and a bunch of high-end features down to a more affordable price with the Forerunner 255.The longstanding series is available in two sizes for the first time with the 255 – a small 41mm-wide case and a larger 46mm model, which means it should fit comfortably on a wider range of runners’ wrists. But it has very big shoes to fill, replacing the well-regarded Forerunner 245 from 2019. Continue reading...","https://www.theguardian.com/technology/2022/jul/11/garmin-forerunner-255-review-runners-best-friend-gets-gps-and-multisport-upgrade-battery"
"124","In The Callisto Protocol, dark and terrible things lurk in space","1660899611000","One of the minds behind deeply unsettling sci-fi classic Dead Space imagines another haunted, forsaken space station in this forthcoming horror gameAn unnamed convict staggers through a lunar prison that’s been sundered by some sort of galactic catastrophe. The steely corridors are shrouded in darkness, save for the neon glow of computer terminals. Every step is tentative, because pulsating monstrosities – other prisoners, mutated into abominable forms – threaten to emerge from every crevice.Few versions of hell loom larger in the imagination than the haunted, derelict space station. You’re alone in the dark, far from home, and stalked by whatever horrors have leaked in from the cosmic void. Steve Papoutsis has been obsessed with this bleak fantasy for years: he worked as a producer on the vaunted Dead Space series, which condemned gamers to their own forsaken Nostromo. The Callisto Protocol, which arrives on consoles and PC later this year, is pitched as a spiritual successor to that franchise. Papoutsis is at the helm once again, and wants to show us just how terrifying the final frontier can be. Continue reading...","https://www.theguardian.com/games/2022/aug/19/in-the-callisto-protocol-dark-and-terrible-things-lurk-in-space"
"125","Swedish gaming giant buys Lord of the Rings and Hobbit rights","1660829607000","Embracer buys Middle-earth Enterprises which controls intellectual property rights to Tolkien’s most famous worksThe company that owns the rights to JRR Tolkien’s works, including The Lord of the Rings and The Hobbit, has been bought by the Swedish gaming firm Embracer Group, which has hinted it could make spin-off films based on popular characters such as Gandalf, Aragorn and Gollum.Embracer has acquired Middle-earth Enterprises, the holding company that controls the intellectual property rights to films, video games, board games, merchandise, theme parks and stage productions relating to Tolkien’s two most famous literary franchises. Continue reading...","https://www.theguardian.com/books/2022/aug/18/swedish-gaming-giant-buys-lord-of-rings-and-hobbit-rights"
"126","The Last Worker paints a picture of a fully-automated future where Amazon rules the world","1660726811000","What would you do if you were the last human left working at a nightmarish future-version of an Amazon warehouse?There can’t be many of us left who’ve never ordered a package from Amazon, despite increasing awareness of the human cost behind that convenience. Upcoming game The Last Worker, the first from developer Oiffy, is a dark comedic take on the horror and absurdity of the online-retail “fulfilment centre”. In an age where we just accept corporate billionaires raking in obscene profit at the expense of an underpaid workforce as a sad fact of life, this game might be the chance we need to find the humour in it all.The Last Worker is a story seen through the eyes of its protagonist, Kurt, set in a world where automation has reached dystopian heights. Kurt is the last human employee working in an otherwise fully automated fulfilment centre for Jüngle, an online retailer which totally isn’t up to anything sinister. His job is to get packaged orders ready for shipping and he’s never made a mistake in 25 years of service, which is the only reason he hasn’t been replaced with a robot. He takes some pride in his work, but when he becomes the reluctant recruit of an anti-Jüngle activist group, might he be pressured into stealthily sabotaging the company?The Last Worker will be out later this year on PC, Switch, Xbox, PS5 and Oculus Quest. Continue reading...","https://www.theguardian.com/games/2022/aug/17/the-last-worker-a-futuristic-satire-in-which-an-online-retail-megacorp-rules-the-world"
"127","Rollerdrome review – skating as a bloodsport","1660654845000","PC, PlayStation 4/5; Roll7/Private DivisionMixing the colour palette of 80s comic books with post-apocalyptic bloodlust, movement in this fluid game feels sublime. Until you get shot in the headSkating of all kinds became a whole thing during the Covid lockdowns. As the pandemic put a pause on indoor socialising, parks became the new pubs – and what better way to escape shut-in misery than gliding around the green? In south London at least, it’s a passion that’s endured: every Sunday without fail, I’m greeted by a gaggle of boombox-toting skaters. Yet for game developer Roll7, this lockdown obsession seemingly took a less wholesome turn. If you ever thought that Tony Hawk’s Pro Skater would be more thrilling as a blood-drenched deathmatch, then this is your game.Channelling the smudged colour palette of 80s comic books and the post-apocalyptic bloodlust of Mad Max, Rollerdrome is a giddying blend of murder and momentum. As in February’s brilliant OlliOlli World, from the same developer, forward motion feels sublime: performing mid-air grabs atop a ramp before dropping into a polished, gym-like court, the fluidity of your flow is entrancing. And then some other deadly derby competitor shoots you in the head. Continue reading...","https://www.theguardian.com/games/2022/aug/16/rollerdrome-review-skating-as-a-bloodsport"
"128","Pushing Buttons: Breaking Bad meets GTA – and other shows I’d like to play","1660647199000","Game adaptations don’t have to be terrible. But as Better Call Saul creator Vince Gilligan admits, bringing action from screen to console isn’t as easy as it soundsDon’t get Pushing Buttons delivered to your inbox? Sign up hereWelcome back to Pushing Buttons! This issue is going out on my birthday. Presents would be nice, but what I actually want is a week off to finally play Elden Ring. Only slightly more importantly, today is also when the finale of Better Call Saul airs in the UK, closing out a story that began with Breaking Bad’s first TV episodes in 2008. I will really miss this series – there is nothing in television quite like creator Vince Gilligan’s sumptuous shots and tight dark-comedic writing. I’ve often wondered why there’s been no Breaking Bad video game – especially because Netflix has shown a great deal of interest in the games, from buying studios to bankrolling endless TV adaptations. (Side note: did you know that Netflix subscribers get access to 24 mostly excellent games for free, including the sci-fi masterpiece Into the Breach? I didn’t, until last week.)I would have expected some drug-empire management game, maybe spliced with scenes from the show, or with scene-setting and dialogue from its writers. Or perhaps an interactive-movie tie-in along the lines of Charlie Brooker’s Black Mirror: Bandersnatch, where your reactions send the story spinning off in different directions. It would be expensive, sure, but Netflix has never minded spending money.Microsoft stopped disclosing sales figures for Xbox consoles long ago, but early in the PlayStation 4/Xbox One era it was fairly clear that the PS4 was streets ahead. It comes as no surprise, then, to learn that the PS4 outsold the Xbox One by more than two to one, as revealed by court documents. Is it any wonder that Microsoft prefers to frame the console wars on its own terms and talk about Game Pass subscribers and engagement instead?The Pokémon world championships are in London this week for the first time. The tournaments will be live-streamed, but Pokémon fans can also pay £10 to go and spectate. I went to this tournament in Washington in 2014 and it’s one of the most wholesome video game events I’ve ever been to – I especially loved all the millennial parents proudly watching their little kids compete.Lastly, enjoy this footage of a game in which you are a squirrel with a gun, which quite deservedly blew up on Twitter over the weekend. Continue reading...","https://www.theguardian.com/games/2022/aug/16/pushing-buttons-better-call-saul-would-make-a-great-game-why-hasnt-it-happened"
"129","Metal: Hellsinger – where video games and heavy-metal music collide","1660561237000","With a blistering bespoke soundtrack, and featuring artists such as System of a Down’s Serj Tankian, this shooter is a metalhead’s fever dreamVideo games and heavy metal music have long shared a passing curiosity with one another. Look no further than the iconography of Doom, or Tim Schafer’s Brütal Legend, for evidence of that. But it was in the mid 00s – during the reign of music and rhythm games such as Guitar Hero – that the link was most obvious. Count me among the ranks of those who learned about Pantera and Megadeth by way of the plastic instrument.Which is why this year’s Metal: Hellsinger is on my radar. The game is a cross between a first person shooter and a rhythm game: by matching your shooting to the tempo of the music, you build a score multiplier that increases the damage you deal. We’ve seen this before in BPM: Bullets Per Minute, but Metal: Hellsinger brings its own setting and original heavy metal soundtrack to the party. Continue reading...","https://www.theguardian.com/games/2022/aug/15/metal-hellsinger-where-video-games-and-heavy-metal-music-collide"
"130","Garmin down: how to still get your activities on to Strava","1595586126000","Garmin servers are offline but you can still share your runs, rides, swims and walks with Strava. Here’s howGarmin Connect and Express have been taken offline by a reported ransomware attack, leaving runners, cyclists, walkers and others unable to sync their activities to Strava. But don’t worry – there is a manual way to upload your activities to Strava while Garmin is down. Here’s how:What you need:Your Garmin watch or cycling computer.The USB charging cable that came with it.A computer with a USB port (practically any computer will do).An internet connection. Continue reading...","https://www.theguardian.com/technology/2020/jul/24/garmin-down-how-to-get-activities-on-strava-ride-swim-walk"
"131","So long and thanks for all the fish","1585810844000","Ask Jack comes to a close following the news that its long-running author has diedI am sorry to have to inform readers of the Guardian’s long-running Ask Jack column that its much-loved author, Jack Schofield, died on Tuesday.Jack was taken to hospital on Friday night following a heart attack and died on Tuesday afternoon. Continue reading...","https://www.theguardian.com/technology/askjack/2020/apr/02/so-long-and-thanks-for-all-the-fish"
"132","What’s the best tablet for video calling grandma?","1585209622000","Chris needs a tablet or video-calling device for his grandma’s Covid-19 isolation. What are the options?I want to get my grandma a tablet for easy video calling. She is elderly and needs to self-isolate, and she is already quite isolated after the recent death of her husband. I am not sure which tablet or which program to use. She isn’t very computer literate.This new Facebook thing looks good but I am sceptical of the brand. ChrisVideo calling used to be a futuristic topic. Today, it is readily available on most devices except, oddly enough, smart TVs. If anything, there’s a plethora of services, and I haven’t tried most of them. The options include Zoom, WhatsApp, Facebook, FaceTime, Google Hangouts, Microsoft Teams, Skype and many more. Zoom is a business service but it works well and is clearly flavour of the month, with downloads up by 1,270%. Fake backgrounds are one of its winning features. Continue reading...","https://www.theguardian.com/technology/askjack/2020/mar/26/what-is-the-best-tablet-for-video-calling-grandma"
"133","What do I need to work from home due to coronavirus?","1584604848000","How best to set up a home office for the short or long term if you’re self-isolatingCoronavirus – latest updatesSee all our latest coronavirus coverageWhat do I need to work at home during the coronavirus outbreak? At this rate, we might all be working from home for a year! How will the broadband providers cope? Do we need a plan B? FranklySwissEveryone will need their own customised solution, but there are two things to think about. First, will you be working at home for two weeks or four months or possibly forever? I share the view that Covid-19 could cause a permanent shift towards home working. Continue reading...","https://www.theguardian.com/technology/askjack/2020/mar/19/work-at-home-coronavirus-office-self-isolating"
"134","Best of the iPhone photography awards 2022 – in pictures","1660564969000","The awards have been celebrating the creativity of iPhone users since 2007. We take a look at a selection of the winners of the 15th annual competition Continue reading...","https://www.theguardian.com/technology/gallery/2022/aug/15/best-of-the-iphone-photography-awards-2022-in-pictures"
"135","Hundreds of Amazon employees stop working over disputed pay rise – video","1659631296000","Hundreds of Amazon workers at the company's Tilbury site in Essex stopped working and gathered in the canteen over a pay dispute on Thursday. Amazon reportedly offered its employees a 35p pay rise, which was rejected. More than 700 employees have gathered in the canteen, according to a regional organiser for GMB union. Employees are calling for a £2-an-hour raise. Some employees have faced disciplinary measures for the protestHundreds of Amazon staff in Essex stop work in protest at 35p pay rise Continue reading...","https://www.theguardian.com/technology/video/2022/aug/04/hundreds-of-amazon-employees-stop-working-over-disputed-pay-rise-video"
"136","How bitcoin is reviving fossil fuel plants – video","1655368171000","Bitcoin requires vast amounts of electricity to facilitate its transactions around the globe. More than twice the energy usage per year of Apple, Facebook, Google, Microsoft and Amazon combined. This demand has led cryptocurrency mining companies to seek out the cheapest electricity possible, and it doesn't get much cheaper than coal. New bitcoin server farms are popping up across the US next to old power plants, many which had all but discontinued operations. Josh Toussaint-Strauss explores how these dying fossil fuel plants have been been revived in the name of cryptocurrencyBitcoin miners revived a dying coal plant – then CO2 emissions soaredBitcoin’s energy usage is huge – we can't afford to ignore itEverything you wanted to know about bitcoin but were afraid to ask Continue reading...","https://www.theguardian.com/technology/video/2022/jun/16/why-bitcoin-is-reviving-fossil-fuel-plants-video"
"137","How Dan Price’s Social Media Fame Fueled Abuse Allegations","1660921539000","Dan Price was applauded for paying a minimum salary of $70,000 at his Seattle company and criticizing corporate greed. The adulation helped to hide and enable his behavior.","https://www.nytimes.com/2022/08/18/technology/dan-price-resign-social-media.html"
"138","TikTok Browser Can Track Users’ Keystrokes, According to New Research","1661109908000","In the web browser used within the TikTok app, supplementary code lets the company track every character typed by users. The company said the capability was for troubleshooting.","https://www.nytimes.com/2022/08/19/technology/tiktok-browser-tracking.html"
"139","Facebook and Instagram Remove Robert Kennedy Jr.’s Nonprofit for Misinformation","1660860851000","The social networking company said that Children’s Health Defense, a group led by Mr. Kennedy, an anti-vaccine activist, had “repeatedly” violated its guidelines by spreading medical misinformation.","https://www.nytimes.com/2022/08/18/technology/facebook-instagram-robert-kennedy-jr-misinformation.html"
"140","A Dad Took Photos of His Naked Toddler for the Doctor. Google Flagged Him as a Criminal.","1661113458000","Google has an automated tool to detect abusive images of children. But the system can get it wrong, and the consequences are serious.","https://www.nytimes.com/2022/08/21/technology/google-surveillance-toddler-photo.html"
"141","Elijah Quashie Is a YouTube Star for Fried Chicken. How Is He Dealing With Inflation?","1660986016000","YouTube star Elijah Quashie, of the U.K. hit “The Pengest Munch,” copes with the rising cost of wings.","https://www.nytimes.com/2022/08/20/business/media/youtube-elijah-quashie-fried-chicken.html"
"142","How the Find My App Became an Accidental Friendship Fixture","1660978812000","Introduced 10 years ago, the app has slowly become a popular way to keep track of friends. But it comes with considerable privacy concerns.","https://www.nytimes.com/2022/08/20/technology/find-my-app-friends.html"
"143","Twitter Tells Employees They Might Get Only Half Their Annual Bonus","1660958106000","The company blamed its financial performance for the potential bonus cut.","https://www.nytimes.com/2022/08/19/technology/twitter-annual-bonus.html"
"144","Lawmakers Demand Social Media Firms Address Threats to Law Enforcement","1660949015000","The Democrats who lead two House panels also expressed concern about “reckless statements” from Republicans after a surge in online threats following the F.B.I. search of Mar-a-Lago.","https://www.nytimes.com/2022/08/19/us/politics/social-media-threats-fbi-trump.html"
"145","She Had an AirTag in Her Lost Luggage. It Led Police to a Baggage Handler’s Home.","1660907803000","An airport worker in Florida was charged with two counts of grand theft after a tracking device aided a sheriff’s investigation.","https://www.nytimes.com/2022/08/19/us/airtags-luggage-theft.html"
"146","The Faded but Winning Pandemic Star","1660840441000","Sales are down, but there is no need to pity the Chromebook.","https://www.nytimes.com/2022/08/18/technology/chromebooks-pandemic-star.html"
"147","Party Videos of Sanna Marin, Finland’s Prime Minister, Draw Criticism","1660835972000","Criticism of the leader, Sanna Marin, 36, over parties she’s attended showed the difficulties of keeping life private in the age of cellphones and social media.","https://www.nytimes.com/2022/08/18/world/europe/finland-prime-minister-sanna-marin-parties.html"
"148","They Lost Crypto in the Crash. They’re Trying to Get It Back.","1660941888000","In a frenzied effort, investors are trying to recover lost funds from Celsius Network, a crypto firm that imploded this summer.","https://www.nytimes.com/2022/08/18/technology/crypto-crash-investments.html"
"149","Why Buying an Electric Car Just Became More Complicated","1660813217000","The new climate, tax and health law signed by President Biden extends a credit for electric vehicle buyers. But there are new strings attached that kick in at different times.","https://www.nytimes.com/2022/08/18/business/electric-vehicle-tax-credits.html"
"150","Wasn’t TikTok Supposed to Be Fun?","1660964087000","No social app remains free of arguments over politics and social issues once it becomes popular.","https://www.nytimes.com/2022/08/17/technology/tiktok-elections-politics.html"
