"Id","Title","Time","Description","Link"
"215","Goa Airport Bus at Rs 200: How To Book Electric AC Goa Airport Bus Tickets Online","1660654080030","The Goa government has started an electric bus service from the airport and you can also take the bus from popular parts of Goa to the airport as well.","https://www.news18.com/news/tech/goa-airport-bus-at-rs-200-how-to-book-electric-ac-goa-airport-bus-tickets-online-5762251.html"
"216","More Users Attacked Via Old Microsoft Office Vulnerability In Q2: Report","1660652588030","This zero-day vulnerability in Internet Explorer's engine MSHTML was first reported in September 2021.","https://www.news18.com/news/tech/more-users-attacked-via-old-microsoft-office-vulnerability-in-q2-report-5762227.html"
"217","Apple May Sack An Employee Over A TikTok Video: Here's Why","1660651282030","Last year, Apple terminated two activists for allegedly sharing confidential information. However, Campbell was quoted as saying that her videos don't contain any confidential information.","https://www.news18.com/news/tech/apple-may-sack-an-employee-over-a-tiktok-video-heres-why-5761891.html"
"218","Job Scams On WhatsApp: You Have Cleared The Job Interview But…","1660647880030","Around 56% of job seekers in India are impacted by job scams during their job hunt. Job seekers between the ages between 20 and 29 years are prime targets of scammers. Now, the modus operandi is simple for scammers: lure desperate young people into paying money upfront by promising jobs with high salaries. ","https://www.news18.com/news/tech/job-scams-on-whatsapp-you-have-cleared-the-job-interview-but-5761321.html"
"219","Dell XPS 13 9315 Launched in India: Specifications, India Pricing, Design and more","1660647074030","Dell XPS 13 is an ultralight offering that targets on-the-go users who want a balance between portability and performance.  It is available in 3 configurations. ","https://www.news18.com/news/tech/dell-xps-13-9315-launched-in-india-specifications-india-pricing-availibility-and-more-5760943.html"
"220","Apple May Launch A Low-Cost iPad And M2-Powered iPad Pro In October After iPhone 14 Launch: Report","1660647030030","The new &quot;low-cost&quot; iPad is said to come with an Apple A14 Bionic chip, a larger display, and a USB type-C port.","https://www.news18.com/news/tech/apple-may-launch-a-low-cost-ipad-and-m2-powered-ipad-pro-in-october-after-iphone-14-launch-report-5761183.html"
"221","WhatsApp Working On Bringing Avatars, Can Be Used As Profile Pictures: Report","1660644397030","WhatsApp has recently announced three new privacy features that allow users to hide their online status, leave groups silently, and block the receiver from taking screenshots of view once messages. ","https://www.news18.com/news/tech/whatsapp-working-on-bringing-avatars-can-be-used-as-profile-pictures-report-5760757.html"
"222","Apple iPhone Trick: Record Video Using Both Front, Back Cameras Simultaneously","1660640352030","Double Camera by Dayworks allows you to simultaneously film using both the front and back cameras of your iPhone. It is currently free to download from the App Store.","https://www.news18.com/news/tech/apple-iphone-trick-record-video-using-both-front-back-cameras-simultaneously-5759257.html"
"223","Samsung Galaxy Z Flip 4, Galaxy Z Fold 4 India Prices Announced: Launch Offers, How to pre-book and more","1660637582030","Samsung Galaxy Z Flip 4 will be  available in Bora Purple, Graphite and Pink Gold colours. It costs Rs 89,999 for the 8GB+128GB variant and Rs 94,999 for the 8GB+256GB variant. ","https://www.news18.com/news/tech/samsung-galaxy-z-flip-4-galaxy-z-fold-4-india-prices-announced-launch-offers-how-to-pre-book-and-more-5759689.html"
"224","OnePlus Working On Foldable Phone? CEO Hints Oppo Find N Hinge Could Be Used","1660629207030","Is OnePlus bringing a foldable smartphone? The company's CEO has teased a hinge design on his Twitter.","https://www.news18.com/news/tech/oneplus-working-on-foldable-phone-ceo-hints-oppo-find-n-hinge-could-be-used-5758195.html"
"225","Android 13 Is Now Rolling Out To Google Pixel Phones: Supported Devices, New Features And More","1660625847030","Android 13 will not be as big an update as its predecessor, but it will come with some major fixes, along with several new cosmetic and convenience features. ","https://www.news18.com/news/tech/android-13-is-now-rolling-out-to-google-pixel-phones-supported-devices-new-features-and-more-5757589.html"
"226","Mac Users Need To Update Their Zoom App Now To Avoid Dangerous Security Flaw","1660622196030","Wardle, the security researcher, also lauded Zoom for the quick response. &quot;Mahalos to Zoom for the (incredibly) quick fix!,&quot; he said in a tweet.","https://www.news18.com/news/tech/mac-users-need-to-update-their-zoom-app-now-to-avoid-dangerous-security-flaw-5757187.html"
"227","Rakesh Jhunjhunwala-backed Nazara Tech Now A Leading Gaming Company","1660571372030","As the Indian game developers begin to expand their global footprint, shares of ace investor Rakesh Jhunjhunwala-backed online gaming company Nazara Technologies surged 20 per cent after the firm reported a 22 per cent rise in net profit for June quarter this year.","https://www.news18.com/news/tech/rakesh-jhunjhunwala-backed-nazara-tech-now-a-leading-gaming-company-5756161.html"
"228","Startup Launches Drone-based Healthcare Network Trial In Arunachal","1660570990030","The project will take place in Seppa, a town in East Kameng District of Arunachal Pradesh, by startup Redwing Labs, which will help deliver medical supplies up to eight times faster than road-based logistics.","https://www.news18.com/news/tech/startup-launches-drone-based-healthcare-network-trial-in-arunachal-5756125.html"
"229","Sony PlayStation4 Pipped Xbox One Sales, Admits Microsoft","1660570651030","Microsoft has finally admitted that Sony PlayStation4 piped its Xbox One gaming console in terms of ales and installed base.","https://www.news18.com/news/tech/sony-playstation4-pipped-xbox-one-sales-admits-microsoft-5756113.html"
"230","Samsung Galaxy Flip 4 May Cost Rs 90,000, Fold 4 at Rs 1.55 Lakh in India","1660570331030","Samsung Galaxy Flip4 is set to cost Rs 90,000 in India and the Galaxy Fold4 will be priced at Rs 1.55 lakh in India. ","https://www.news18.com/news/tech/samsung-galaxy-flip-4-may-cost-rs-90000-fold-4-at-rs-1-55-lakh-in-india-5756101.html"
"231","The Wait For 5G is Over; Digital India Will Reach Every Village Now: PM Modi","1660534280030","Prime Minister Narendra Modi while addressing the nation from Red Fort in New Delhi as India completed its 75th year of Independence mentioned that the “wait for 5G is over, digital India will now reach every village”. ","https://www.news18.com/news/tech/the-wait-for-5g-is-over-digital-india-will-reach-every-village-now-pm-modi-5752555.html"
"232","Zoom Installer Flaw Can Give Attackers Root Access To Mac: Report","1660473942030","A security researcher has found a way that an attacker could leverage the macOS version of Zoom to gain access over the entire operating system.","https://www.news18.com/news/tech/zoom-installer-flaw-can-give-attackers-root-access-to-mac-report-5750833.html"
"233","Man Jailed For Allegedly Stalking Ex-girlfriend With Apple AirTag: Report","1660473634030","Christopher Paul Trotman, 41, harassed his ex with constant phone calls and questions, before ordering an AirTag on Amazon and gluing it to her rear bumper to track her every move, a court heard.","https://www.news18.com/news/tech/man-jailed-for-allegedly-stalking-ex-girlfriend-with-apple-airtag-report-5750821.html"
"234","Made-In-India Anti-Drone System Deployed Near Red Fort Ahead of Independence Day: Watch Video","1660471223030","Ahead of the Independence Day celebrations in New Delhi on August 15, anti-drone systems have been deployed near Red Fort to counter any unwanted drones. ","https://www.news18.com/news/tech/made-in-india-anti-drone-system-deployed-near-red-fort-ahead-of-independence-day-watch-video-5750587.html"
"235","6 In 10 People See False Or Misleading Information Daily Or Weekly: Survey","1660460397030","More than six in 10 people, including in India, think they see false or misleading information on at least a weekly basis, a survey with participation from Google has revealed.","https://www.news18.com/news/tech/6-in-10-people-see-false-or-misleading-information-daily-or-weekly-survey-5749519.html"
"236","Marvel's Spider-Man Remastered Launched on PC: 3 Things To Know Before Buying","1660410359030","Spider-Man Remastered for PC brings a plethora of upgrades including DualSense controller support, unlocked frame rate, ultrawide aspect ratios and more. ","https://www.news18.com/news/tech/marvels-spider-man-remastered-launched-on-pc-5748373.html"
"237","Google Fined $40 Million For Misleading Users On Android Location Tracking","1660395359030","The Federal Court in Australia on Friday ordered Google to pay over $40 million in penalties for making misleading representations to consumers about the collection and use of their personal location data on Android phones.","https://www.news18.com/news/tech/google-fined-40-million-for-misleading-users-on-android-location-tracking-5747539.html"
"238","LinkedIn Lays Off Entire Global Events Marketing Team: Report","1660394559030","Microsoft-owned professional networking platform itself has laid off workers from its global events marketing vertical. ","https://www.news18.com/news/tech/linkedin-lays-off-entire-global-events-marketing-team-report-5747491.html"
"239","Xiaomi Fixes Bugs In Its Mobile Payment Mechanism","1660394103030","Xiaomi has fixed some bugs that were identified in its mobile payment mechanism by cyber security researchers, Check Point Research (CPR) said","https://www.news18.com/news/tech/xiaomi-fixes-bugs-in-its-mobile-payment-mechanism-5747425.html"
"240","'There Will Be Blood On Streets,' Google Execs Warn Employees About Layoffs","1660393820030","As Big Tech companies begin to lay off employees in the global economic downturn, Google executives have reportedly warned workers to either boost performance or prepare to leave as &quot;there will be blood on the streets&quot; if the next quarterly earnings are not good.","https://www.news18.com/news/tech/there-will-be-blood-on-streets-google-execs-warn-employees-about-layoffs-5747377.html"
"241","Hacker Breached Our Network Via Employee Google Account: Cisco","1660393394030","Networking giant Cisco has admitted a cyber-security breach via the &quot;successful compromise&quot; of an employee's personal Google account, saying that no data was compromised.","https://www.news18.com/news/tech/hacker-breached-our-network-via-employee-google-account-cisco-5747317.html"
"242","VLC Media Player Banned In India: VLC Apps Still Working Fine But This Could Be The Reason For Ban","1660372343030","While the VLC media player app is still available for download on both the Apple App store and Google Play store, the government has blocked access to the official VLC media player website “www.videolan.org”.","https://www.news18.com/news/tech/vlc-media-player-banned-in-india-vlc-apps-still-working-fine-but-this-could-be-the-reason-for-ban-5743909.html"
"243","Delhiites Prefer Apple iPhones over Other Brands: Survey","1660332429030","It would be interesting to understand the dynamics of the refurbished smartphone market moving forward. Barring a few inconsistencies, the market promises a host of benefits including less e-waste, budget-friendly deals and ease of selling used phones online.","https://www.news18.com/news/tech/delhiites-prefer-apple-iphones-over-other-brands-5742037.html"
"244","Microsoft Lays Off 200 Workers From R&D Projects, Overall 2000 Since July: Report","1660308305030","The additional job cuts were concentrated in Microsoft's Modern Life Experiences (MLX) group, which was put together in 2018.","https://www.news18.com/news/tech/microsoft-lays-off-200-workers-from-rd-projects-overall-2000-since-july-report-5740585.html"
"245","Planning to buy Apple iPhone 14? Be Prepared To Pay More","1660305175030","Apple iPhone 14 series will be launched next month. A recent rumour had suggested that the company may launch the iPhone 14 series on September 6, when the iPhone launch traditionally takes place in mid-September. ","https://www.news18.com/news/tech/apple-iphone-14-series-could-be-priced-15-percent-higher-than-iphone-13-report-5740117.html"
"246","Virat Kohli backed Hyperice Hypervolt Go 2 Launched: Price, Availability And Features","1660298511030","Virat Kohli-backed Hyperice Hypervolt Go 2 has been launched at a price of Rs 18,999 for athletes and individuals looking to speed-up recovery and improve flexibility.","https://www.news18.com/news/tech/virat-kohli-backed-hyperice-hypervolt-go-2-launched-price-availability-and-features-5738989.html"
"247","Reliance Jio Independence Day Benefits: Take A Look At All Offers From Jio To Mark Independence Day","1660293862030","These new initiatives that are a part of Jio's Independencce Day Offers include ‘Jio Freedom Offer’ with Rs 3,000 worth of benefits on the Rs 2,999 recharge plan, a special ‘90-day Unlimited Plan’ for Rs 750, and more.","https://www.news18.com/news/tech/reliance-jio-independence-day-benefits-take-a-look-at-all-offers-from-jio-to-mark-independence-day-5738419.html"
"248","Motorola Launches Moto G62 5G Budget 5G Offering In India: Price, Specifications And More","1660286504030","The Motorola Moto G62 will go on sale in India starting August 19. The smartphone is priced at Rs 17,999 onwards in the country. ","https://www.news18.com/news/tech/motorola-launches-moto-g62-5g-budget-5g-offering-in-india-price-specifications-and-more-5737243.html"
"249","Nvidia 40 Series Graphics Cards Coming Soon: Should You Wait Or Buy The Nvidia 30 Series?","1660284292030","Nvidia is said to bring its next-gen GeForce RTX 40-series GPUs later this year. But should you wait for it or get a 30-series GPU right now? Read on to find out!","https://www.news18.com/news/tech/nvidia-40-series-graphics-cards-coming-soon-should-you-wait-or-buy-the-nvidia-30-series-5736637.html"
"250","Xiaomi Mix Fold 2 Launched To Give Galaxy Z Fold 4 Some Much-Needed Competition: Price, Specs And More","1660279318030","The Xiaomi Mix Fold 2 has been launched with a Leica-branded triple rear camera setup and a Qualcomm Snapdragon 8+ Gen 1 chipset. ","https://www.news18.com/news/tech/xiaomi-mix-fold-2-launched-to-give-galaxy-z-fold-4-some-much-needed-competition-price-specs-and-more-5736043.html"
"251","Moto Razr 2022 Launched To Give Galaxy Z Flip 4 Some Competition: Check Out Price, Specs And More","1660275719030","The Moto Razr 2022 brings some serious competition to the Galaxy Z Flip 4. ","https://www.news18.com/news/tech/moto-razr-2022-launched-to-give-galaxy-z-flip-4-some-competition-check-out-price-specs-and-more-5735605.html"
"252","Krafton says will cooperate with Indian govt to resolve BGMI ban","1660223980030","Battlegrounds Mobile India (BGMI) developer Krafton said it is closely cooperating with the Indian authorities after the ban on its most popular Battle Royale game with over 100 million users in the country.","https://www.news18.com/news/tech/krafton-says-will-cooperate-with-indian-govt-to-resolve-bgmi-ban-5734303.html"
"253","Industry Body Questions Govt's Call For 5G Demand Studies From Enterprises","1660223651030","The government announced to undertake demand studies for the direct assignment of spectrum to enterprises with net worth more than Rs 100 crore which are willing to set up private captive 5G networks.","https://www.news18.com/news/tech/industry-body-questions-govts-call-for-5g-demand-studies-from-enterprises-5734255.html"
"254","Disney+ Hotstar Adds 8.3 Million Subscribers, Hits 58.4 Million Users","1660213776030","The company said that international Disney+ subscribers increased by 6 million to reach 49.2 million. ","https://www.news18.com/news/tech/disney-hotstar-adds-8-3-million-subscribers-hits-58-4-million-users-5732563.html"
"255","After Samsung, Xiaomi Set To Unveil Its Latest Foldable Mix Fold 2 Today: Here's What To Expect","1660202593030","The Xiaomi Mix Fold 2 will be launched only in China initially. It is not known if the company will bring the foldable to India. ","https://www.news18.com/news/tech/after-samsung-xiaomi-set-to-unveil-its-latest-foldable-mix-fold-2-today-heres-what-to-expect-5730703.html"
"256","Do You Use Telegram? Here's How To Schedule Messages On The WhatsApp Competitor","1660198258030","You can press and hold the send message button in any chat to schedule a message on Telegram.","https://www.news18.com/news/tech/do-you-use-telegram-heres-how-to-schedule-messages-on-the-whatsapp-competitor-5730349.html"
"257","Microsoft Claims Sony Pays Developers 'Blocking Rights' To Keep Games Off Xbox Game Pass","1660195751030","While Microsoft's claims make it seem like Sony is paying developers to quash competition, the PlayStation maker could be paying this for exclusive rights to its own streaming services.","https://www.news18.com/news/tech/microsoft-claims-sony-pays-developers-blocking-rights-to-keep-games-off-xbox-game-pass-5729881.html"
"258","Samsung Galaxy Buds 2 Pro Premium TWS Earbuds Launched: Price, Features, Specs And More","1660139327030","The Samsung Galaxy Buds 2 Pro come with active noise cancellation, wireless charging, and more premium features.","https://www.news18.com/news/tech/samsung-galaxy-buds-2-pro-premium-tws-earbuds-launched-price-features-specs-and-more-5727175.html"
"259","Samsung Galaxy Watch 5 And Watch 5 Pro Powered By WearOS 3.5 Launched: Price, Specifications","1660137591030","Samsung Galaxy Watch 5 series gets an AMOLED display with support for fast charging and running on the WearOS platform.","https://www.news18.com/news/tech/samsung-galaxy-watch-5-and-watch-5-pro-powered-by-wearos-3-5-launched-price-specifications-5726737.html"
"260","Samsung Galaxy Z Fold 4, Galaxy Z Flip 4 Launched: Check Out Price, Specifications And More","1660137008030","Both the Samsung Galaxy Z Fold 4 and Galaxy Z Flip 4 come with minor design changes over their predecessors. Samsung has also launched the Galaxy Watch 5 smartwatch alongside the new foldables. ","https://www.news18.com/news/tech/samsung-galaxy-z-fold-4-galaxy-z-flip-4-launched-check-out-price-specifications-and-more-5727037.html"
"261","Top Tech News - August 10: Jio Independence Day 2022 Offer, Xiaomi Foldable Phone Launching This Week And More","1660134587030","In the latest episode of top tech news we share the details of the new long-term prepaid plan from Jio, Xiaomi launching Mix Fold 2 this week and more.","https://www.news18.com/news/tech/top-tech-news-august-10-jio-independence-day-2022-offer-xiaomi-foldable-phone-launching-this-week-and-more-5726965.html"
"262","The Epic Independence Day Sale: MSI Delivers The Freedom To Upgrade With Its Unbelievable Discounts","1660133316030"," Freedom is having good choices, of being able to make them with ease.","https://www.news18.com/news/tech/the-epic-independence-day-sale-msi-delivers-the-freedom-to-upgrade-with-its-unbelievable-discounts-2-5726599.html"
"263","India Now Exploring Adoption of Common Charger for Mobile Devices; Meeting on August 17","1660131388030","The government is exploring the adoption of a common charger for a variety of devices, including smartphones and tablets, and has called a meeting on August 17 to discuss the issue with the industry.","https://www.news18.com/news/tech/india-now-exploring-adoption-of-common-charger-for-mobile-devices-meeting-on-august-17-5726323.html"
"264","Google Takes On Apple, Says It Needs To Fix Messaging By Adopting RCS","1660130933030","Google took control of RCS in 2019 and since then it has been wanting Apple to switch sides so that iPhone and Android users can use the same technology for messaging. But does it have a point?","https://www.news18.com/news/tech/google-takes-on-apple-says-it-needs-to-fix-messaging-by-adopting-rcs-5726443.html"
"265","Reliance Jio Launches JioGamesWatch Streaming Platform For Gamers: All You Need To Know","1660130742030","JioGamesWatch streaming platform will be a part of JioGames that started in 2019 as a one-stop-shop for gamers, publishers, developers for online games, tournaments, esports, and more.","https://www.news18.com/news/tech/reliance-jio-launches-jiogameswatch-streaming-platform-for-gamers-all-you-need-to-know-5726377.html"
"266","Apple Won't Face Any Delays With iPhone 14 Launch: Analyst","1660129560030","Apple is expected to launch the new iPhone 14 series sometime next month, but recent reports suggest the company could face supply issues.","https://www.news18.com/news/tech/apple-wont-face-any-delays-with-iphone-14-launch-analyst-5726281.html"
"267","Samsung Unpacked 2022 Event Live Updates: Samsung Launches Galaxy Z Fold 4, Z Flip 4, Watch 5 Series And Buds2 Pro","1660124641030","We bring you all the live updates from Samsung's Galaxy Unpacked event for the Galaxy Z Fold 4 and Galaxy Z Flip 4 launch.","https://www.news18.com/news/tech/samsung-galaxy-z-fold-4-live-updates-samsung-to-launch-new-foldables-at-unpacked-event-shortly-5725495.html"
"268","HP Envy All-in-One PC Series With 12th Gen Intel Core Processor Launched In India: Price, Specifications","1660123748030","HP has introduced its latest AIO PCs in India with different screen options that get different hardware from Intel and focuses on varied users.","https://www.news18.com/news/tech/hp-envy-all-in-one-pc-series-with-12th-gen-intel-core-processor-launched-in-india-price-specifications-5725477.html"
"269","Snapchat+ Premium Subscription Service Comes To India: Price And Features","1660122062030","Snapchat introduced its premium subscription service in global markets earlier and now it is targeting a market like India with a different approach.","https://www.news18.com/news/tech/snapchat-premium-subscription-service-comes-to-india-price-and-features-5725255.html"
"270","Twitter Had A Brief Outage Affecting Thousands: Here’s What Caused It","1660120204030","Twitter users were unable to access their timelines and some even reported they have been logged out of their account.","https://www.news18.com/news/tech/twitter-had-a-brief-outage-affecting-thousands-heres-what-caused-it-5724895.html"
"271","3 iPad Productivity Apps That Will Change The Way You Use Your iPad","1660119730030","The days of the iPad finally taking over as a laptop replacement are nearing, thanks to the constant launch of pro-grade apps that are sure-shot replacements for their bigger counterparts.","https://www.news18.com/news/tech/3-ipad-productivity-apps-that-will-change-the-way-you-use-your-ipad-5724841.html"
"272","Samsung Galaxy Z Fold 4, Galaxy Z Flip 4 Launch Today: How To Watch Live And What To Expect","1660118824030","The Samsung Galaxy Z Fold 4 and Galaxy Z Flip 4 will be launched at 6:30PM IST today. Samsung is also speculated to launch the Samsung Galaxy Watch 5 series during the event.","https://www.news18.com/news/tech/samsung-galaxy-z-fold-4-galaxy-z-flip-4-launch-today-how-to-watch-live-and-what-to-expect-5724619.html"
"273","OnePlus 10 Pro Starts Getting OxygenOS 13 Update In Beta: New Features, How To Update And More","1660114227030","OnePlus had announced OxygenOS 13 on August 3 during the OnePlus 10T 5G launch event. The OnePlus 10T 5G will be the next smartphone after OnePlus 10 Pro to get the latest Android 13 update.","https://www.news18.com/news/tech/oneplus-10-pro-starts-getting-oxygenos-13-update-in-beta-new-features-how-to-update-and-more-5723971.html"
"274","Moto G32 Budget Smartphone Launched In India: Price, Specifications And More","1660108586030","The Moto G32 will go on sale starting August 16 on Flipkart. The smartphone has been launched in two colour options - Satin Silver and Mineral Grey.","https://www.news18.com/news/tech/moto-g32-budget-smartphone-launched-in-india-price-specifications-and-more-5723185.html"
"275","Chinese Smartphone Ban in India: China Responds As India Scans Mobile Brands To Check Financial Frauds","1660107075030","Chinese smartphone makers are already facing scrutiny from Indian authorities over their finances on suspicion of tax evasion and money laundering.","https://www.news18.com/news/tech/chinese-smartphone-ban-in-india-china-responds-as-india-scans-mobile-brands-to-check-financial-frauds-5722927.html"
"276","WhatsApp Brings New Privacy Features Including Ability To Hide Online Status: All You Need To Know","1660104754030","The new features are rolling out now for users. If you have not received the features on your WhatsApp, chances are you will get them soon.","https://www.news18.com/news/tech/whatsapp-brings-new-privacy-features-including-ability-to-hide-online-status-all-you-need-to-know-5722741.html"
"277","Reliance Jio Introduces Jio Independence Day 2022 Offer With Benefits Worth Rs 3,000: All Details","1660066683030","Jio Independence Day 2022 Offer gives you data, SMS, calling and other set of benefits with a validity of 1 year.","https://www.news18.com/news/tech/reliance-jio-introduces-jio-independence-day-2022-offer-with-benefits-worth-rs-3000-all-details-5721745.html"
"278","BGMI India Ban: Gaming Companies Urge PM Modi For 'Uniform And Fair Treatment'","1660052815030","BGMI was removed from Google Play Store and Apple App Store after the Indian Govt ordered the companies to stop offering it to users in India.","https://www.news18.com/news/tech/bgmi-india-ban-gaming-companies-urge-pm-modi-for-uniform-and-fair-treatment-5721013.html"
