"Id","Title","Time","Description","Link"
"1","How to outsmart fake news in your Facebook feed","1479500478000","Fake news is actually really easy to spot -- if you know how. Consider this your New Media Literacy Guide.","http://www.cnn.com/2016/11/18/tech/how-to-spot-fake-misleading-news-trnd/index.html?eref=rss_tech"
"2","Revealed: Winners of the 'Oscars of watches'","1479500243000","It's the prize giving ceremony that everyone's on time for.","http://www.cnn.com/2016/11/18/luxury/grand-prix-horlogerie-oscars-of-watches-2016/index.html?eref=rss_tech"
"3","Driverless 'Roborace' car makes street track debut","1479500495000","It is a car kitted out with technology its developers boldly predict will transform our cities and change the way we live.","http://www.cnn.com/2016/11/18/motorsport/roborace-marrakech-cop22-formula-e/index.html?eref=rss_tech"
"4","Flying a sports car with wings","1479500243000","Piloting one of the breed of light aircraft is said to be as easy as driving a car","http://www.cnn.com/2016/11/18/aviation/sports-car-with-wings-icon-a5/index.html?eref=rss_tech"
"5","Brightest supermoon since 1948","1479317908000","See photos of November's supermoon -- the brightest in nearly 70 years.","http://www.cnn.com/2016/11/14/world/gallery/supermoon-november-2016/index.html?eref=rss_tech"
"6","This NASA astronaut voted from space","1478629072000","From infinity and beyond, he found a way to vote.","http://www.cnn.com/2016/11/07/politics/nasa-astronaut-space-vote-election-2016/index.html?eref=rss_tech"
"7","Teen girls prepare for space launch","1479398842000","Teenage girls have designed Africa's first private satellite due to launch into space in 2017. It's hoped it can monitor and find answers to South Africa's drought crisis.","http://www.cnn.com/2016/11/15/tech/girls-design-africa-space-satellite/index.html?eref=rss_tech"
"8","Going to space is a real pain in the back","1478628671000","A six-month stay on the International Space Station can be a pain in the back for astronauts. While they may gain up to 2 inches in height temporarily, that effect is accompanied by a weakening of the muscles supporting the spine, according to a new study.","http://www.cnn.com/2016/10/26/health/astronaut-back-pain-spine-health-space/index.html?eref=rss_tech"
"9","Russian gamers race to prevent nuclear 'war'","1478118679000","""Attention! Attention!"" blares the Russian voice from a loudspeaker. ""The nuclear bombs will be launched in one hour.""","http://www.cnn.com/2016/10/29/europe/russia-nuclear-drills/index.html?eref=rss_tech"
"10","What parents should know about the VR gear kids want","1479399163000","Thinking about treating your family to a little virtual reality this holiday? Have no idea where to start? Don't worry. From Google's inexpensive Cardboard VR viewer to Sony's new PlayStation VR, this guide will help you figure out what makes sense for your family's interests, needs and budget.","http://www.cnn.com/2016/11/14/health/virtual-reality-gear-kids-holidays/index.html?eref=rss_tech"
"11","Japan's boom in weird wearable tech","1478901347000","What do Discman, Tamagotchi, and Game Boy have in common?","http://www.cnn.com/2016/11/09/asia/on-japan---wearable-tech/index.html?eref=rss_tech"
"12","Cell phones, screens are keeping your kid awake","1478901367000","These days, teachers often face classrooms filled with yawning students who stayed up late snapping selfies or playing online games.","http://www.cnn.com/2016/10/31/health/kids-sleep-screens-tech/index.html?eref=rss_tech"
"13","Explained: What is a DDoS attack and how Google stopped the biggest one","1661149482030","In a blog post, Google said that back on June 1, a Google Cloud Armor customer was targeted with a series of HTTPS DDoS attacks which peaked at 46 million requests per second. As per Google, this is the largest Layer 7 DDoS reported to date.","https://timesofindia.indiatimes.com/gadgets-news/explained-what-is-a-ddos-attack-and-how-google-stopped-the-biggest-one/articleshow/93703324.cms"
"14","Continuity Camera: Using iPhone as a webcam on Mac, how it works, what you need and more","1661147891030","With macOS Ventura — the next big software upgrade for Mac — Apple wants to change that with a rather interesting feature called Continuity Camera.","https://timesofindia.indiatimes.com/gadgets-news/continuity-camera-using-iphone-as-a-webcam-on-mac-how-it-works-what-you-need-and-more/articleshow/93702648.cms"
"15","This is what Steve Jobs initially wanted to name Safari","1661147735030","","https://timesofindia.indiatimes.com/gadgets-news/this-is-what-steve-jobs-initially-wanted-to-name-safari/articleshow/93702548.cms"
"16","Bungie set for Destiny Showcase 2022: Start date, time and other details","1661147528030","According to the blog post, the Destiny Showcase 2022 event will be streamed on -- Twitch, YouTube and Bilibili after an hour-long preshow that will begin before the event. Moreover, the game will also offer Twitch drops for the first time and players can grab a Starbirth emblem as a reward for streaming the event.","https://timesofindia.indiatimes.com/gadgets-news/bungie-set-for-destiny-showcase-2022-start-date-time-and-other-details/articleshow/93702481.cms"
"17","Monsoon allergies: Are air purifiers helpful","1661144268030","Here's talking about the high levels of indoor allergens and how certain air purifiers are designed to clean the air in a room by trapping allergens by pushing filtered, clean air back into the space.","https://timesofindia.indiatimes.com/gadgets-news/monsoon-allergies-are-air-purifiers-helpful/articleshow/93701307.cms"
"18","OnePlus Watch receives a price cut in India: New price and more","1661143832030","OnePlus launched its first smartwatch -- OnePlus Watch – in India in July 2021. The company has now reduced the price of the wearable. OnePlus Watch comes in the affordable premium segment. There are not not many smartwatches priced above Rs 10,000 in the market. Incidentally, the OnePlus has announced the price cut for only one model of the OnePlus Watch.","https://timesofindia.indiatimes.com/gadgets-news/oneplus-watch-receives-a-price-cut-in-india-new-price-and-more/articleshow/93701152.cms"
"19","Garena Free Fire Max Redeem Codes for August 22, 2022: Win rare costumes, skins and more","1661143618030","The game's creators are constantly adding alphanumeric codes to the game. These codes provide players the opportunity to win free prizes. The codes can also be used to unlock various steps and earn different reward points.","https://timesofindia.indiatimes.com/gadgets-news/garena-free-fire-max-redeem-codes-for-august-22-2022-win-rare-costumes-skins-and-more/articleshow/93700976.cms"
"20","Coin Master: August 22, 2022 Free Spins and Coins link","1661143003030","The Coin Master also has a time slot machine that can help you get additional coins and other sundries to help you enhance your community. Players must spin the slot machine and collect free gifts in order to fully build their hamlet.","https://timesofindia.indiatimes.com/gadgets-news/coin-master-august-22-2022-free-spins-and-coins-link/articleshow/93700793.cms"
"21","Apple may start showing users ads in this app","1661138320030","Apple will not show the regular banner ads that are visible on many websites. Instead, these will be paid search results that restaurants or businesses can pay for to promote their establishments.","https://timesofindia.indiatimes.com/gadgets-news/apple-may-start-showing-users-ads-in-this-app/articleshow/93699672.cms"
"22","Xiaomi reportedly cut 900 jobs as 'revenue troubles in India and China hurt","1661136126030","Economic uncertainty seems to be hurting Chinese smartphone brand Xiaomi. According to the South China Morning Post, the company has cut 900 jobs. The job cuts come as the company saw a 20% fall in its global revenue during the June quarter. Xiaomi posted a steep drop in second quarter revenue as the world's biggest smartphone market shrank, hit by strict Covid restrictions. The company's trouble seems to be both in India and its home country, China.","https://timesofindia.indiatimes.com/gadgets-news/xiaomi-reportedly-cut-900-jobs-as-revenue-troubles-in-india-and-china-hurt/articleshow/93698799.cms"
"23","Quordle 210 for August 22 solved: Check todays’ hints, clues and answers","1661134539030","Quordle is back with another exciting set of puzzles for you. Are you all set to take up the challenge and begin the brainstorming session? If yes, then let’s get you some hints and clues to help you guess the correct answer for today’s Quordle 210. In case you want to take some guesses instead of jumping to the answer directly then you can have a look at the hints given below.","https://timesofindia.indiatimes.com/gadgets-news/quordle-210-for-august-22-solved-check-todays-hints-clues-and-answers/articleshow/93698320.cms"
"24","Wordle 429 answers revealed: Hints, clues and solutions for August 22, 2022","1661134120030","Wordle has now become a part of our everyday life and it has been gaining popularity day by day. This game is a good choice for those who like to play and learn new words everyday. However, there are times when the puzzle becomes so confusing when users start seeking for hints and clues to guess the correct answer. It is important to walk through the right hints to guess the correct answer. That’s why we are here to help you with some hints and clues for today’s Wordle.","https://timesofindia.indiatimes.com/gadgets-news/wordle-429-answers-revealed-hints-clues-and-solutions-for-august-22-2022/articleshow/93698232.cms"
"25","iPhone users, why you may 'thank' TikTok ban in India","1661053583030","Felix Krause, Founder of Fastlane that was acquired by Google, said that when the user opens any link on the TikTok iOS app, it's opened inside their in-app browser.","https://timesofindia.indiatimes.com/gadgets-news/iphone-users-why-you-may-thank-tiktok-ban-in-india/articleshow/93690063.cms"
"26","Coin Master: August 21, 2022 Free Spins and Coins link","1661059860030","Players can gather coins in this game in a variety of ways. Players can raid and attack the towns of other players in order to steal cash. You can even get free extra spins in this game. Coin Master offers free spins that can be used to gather coins and other prizes.","https://timesofindia.indiatimes.com/gadgets-news/coin-master-august-21-2022-free-spins-and-coins-link/articleshow/93687649.cms"
"27","Wordle 428 answers revealed: Hints, clues and solutions for August 21, 2022","1661057453030","Wordle has now become a part of our everyday life and it has been gaining popularity day by day. This game is a good choice for those who like to play and learn new words everyday. However, there are times when the puzzle becomes so confusing when users start seeking for hints and clues to guess the correct answer. It is important to walk through the right hints to guess the correct answer. That’s why we are here to help you with some hints and clues for today’s Wordle.","https://timesofindia.indiatimes.com/gadgets-news/wordle-428-answers-revealed-hints-clues-and-solutions-for-august-21-2022/articleshow/93687230.cms"
"28","OnePlus Nord Wired earphones, Nord smartwatch more tipped to launch soon","1661000798030","According to a latest online leak, OnePlus is expected to launch a new Nord series product in India soon. The company is expected to launch the OnePlus Nord Wired earphones with 9.2mm dynamic drivers and 3.5mm audio jack support. Apart from the earphones, the Chinese smartphone maker is also expected to launch a Nord series smartwatch, smart band and earbuds. The leak also adds that OnePlus may soon foray into the AIoT space.","https://timesofindia.indiatimes.com/gadgets-news/oneplus-nord-wired-earphones-nord-smartwatch-more-tipped-to-launch-soon/articleshow/93680551.cms"
"29","Samsung Galaxy A53 5G receives a price drop: New price, specs and more","1660992072030","Samsung has slashed the price of another mi-range 5G smartphone. Samsung Galaxy A53 5G has received a price cut of Rs 3,000. Launched in March this year, the smartphone comes in two variants and both of them have got a price cut. So, if you are also planning to purchase a 5G-enabled smartphone, then this may be the right time to buy one.","https://timesofindia.indiatimes.com/gadgets-news/samsung-galaxy-a53-5g-receives-a-price-drop-new-price-specs-and-more/articleshow/93677796.cms"
"30","Report warns, USB drives pose a grave data security concern for enterprises","1660983585030","Removable media like USBs or pen drives continues to be a serious data breach concern for various industries as this year, 52 percent of cyber threats were specifically designed to use such removable media, up from 32 per cent in 2021, a new report claimed. According to the '2022 Honeywell Industrial Cybersecurity USB Threat Report,' the threat of USB-borne malware continues to be a serious concern and the rise shows that the threats designed to use removable media have reached a dangerously high level.","https://timesofindia.indiatimes.com/gadgets-news/report-warns-usb-drives-pose-a-grave-data-security-concern-for-enterprises/articleshow/93675441.cms"
"31","US-based e-commerce giant cuts 900 jobs: Read CEO Niraj Shah's open letter on layoffs","1660983342030","US-based E-commerce company Wayfair is cutting nearly 900 jobs, or about 5% of its global workforce. In a regulatory filing with the US Securities and Exchange Commission (SEC), the online furniture provider said that on August 19, 2022, ""Wayfair announced a workforce reduction involving approximately 870 employees in connection with its previously announced plans to manage operating expenses and realign investment priorities."" CEO Niraj Shah wrote in an open letter to employees about the job cuts. In the letter, Shah said, the layoffs were a ""difficult decision"" resulting from Covid-19. Here's the letter as it appeared on the company's website.","https://timesofindia.indiatimes.com/gadgets-news/us-based-e-commerce-giant-cuts-900-jobs-read-ceo-niraj-shahs-open-letter-on-layoffs/articleshow/93675319.cms"
"32","Wordle 427 answers revealed: Hints, clues and solutions for August 20, 2022","1660972413030","Wordle has now become a part of our everyday life and it has been gaining popularity day by day. This game is a good choice for those who like to play and learn new words everyday. However, there are times when the puzzle becomes so confusing when users start seeking for hints and clues to guess the correct answer. It is important to walk through the right hints to guess the correct answer. That’s why we are here to help you with some hints and clues for today’s Wordle.","https://timesofindia.indiatimes.com/gadgets-news/wordle-427-answers-revealed-hints-clues-and-solutions-for-august-20-2022/articleshow/93672258.cms"
"33","Is there a green solution to the vinyl record backlog?","1661037058000","Green Vinyl Records is taking the vinyl out of vinyl to offer more environmentally-friendly LPs.","https://www.bbc.co.uk/news/technology-62426472?at_medium=RSS&at_campaign=KARANGA"
"34","Andrew Tate banned from Facebook and Instagram","1660929077000","Meta removes influencer Andrew Tate from its platforms for violating its policies.","https://www.bbc.co.uk/news/technology-62602913?at_medium=RSS&at_campaign=KARANGA"
"35","Sites ban gamer who removed Spider-Man Pride flags","1660923464000","The user replaced them with American flags in the PC version of the Spider-Man Remastered video game.","https://www.bbc.co.uk/news/technology-62605749?at_medium=RSS&at_campaign=KARANGA"
"36","Hackers may have exploited security flaws - Apple","1660906362000","Users of some models of iPhone, iPad and Mac are being urged to run ""important"" security update.","https://www.bbc.co.uk/news/technology-62602909?at_medium=RSS&at_campaign=KARANGA"
"37","Driverless cars: Experts warn no easy answer to how safe they should be","1660864676000","It might not be enough for self-driving cars to be safer than usual cars as people expect more, experts say.","https://www.bbc.co.uk/news/technology-62598618?at_medium=RSS&at_campaign=KARANGA"
"38","Doubts cast over Elon Musk's Twitter bot claims","1660879317000","Elon Musk thinks a third of visible Twitter accounts could be bots, but researchers have their reservations.","https://www.bbc.co.uk/news/technology-62571733?at_medium=RSS&at_campaign=KARANGA"
"39","Fifa 23: EA honours 99% discount price error on football game's new edition","1660840286000","A glitch on India's Epic Games store let fans pre-order the new edition for the equivalent of 5p.","https://www.bbc.co.uk/news/technology-62590619?at_medium=RSS&at_campaign=KARANGA"
"40","TikTok to teach influencers about US mid-term election rules","1660763798000","The platform says it is to do more to ensure influencers understand that it prohibits paid political ads.","https://www.bbc.co.uk/news/technology-62552702?at_medium=RSS&at_campaign=KARANGA"
"41","Young watch almost seven times less TV than over-65s - Ofcom","1660691665000","The average 16 to 24-year-old watches TV for 53 minutes a day compared with nearly six hours for over-65s.","https://www.bbc.co.uk/news/technology-62506041?at_medium=RSS&at_campaign=KARANGA"
"42","Holocaust activist seems to talk to guests at her funeral","1660652155000","Conversational video tech allowed the late Marina Smith to answer mourners' questions via recordings.","https://www.bbc.co.uk/news/technology-62552696?at_medium=RSS&at_campaign=KARANGA"
"43","Chinese internet giants hand algorithm data to government","1660633681000","Alibaba and Tiktok-owner ByteDance are among firms that have shared information with regulators.","https://www.bbc.co.uk/news/business-62544950?at_medium=RSS&at_campaign=KARANGA"
"44","Cost of living: Government to simplify broadband access","1660575270000","The government says new system will give those receiving benefits better access to cheaper broadband.","https://www.bbc.co.uk/news/technology-62548810?at_medium=RSS&at_campaign=KARANGA"
"45","NHS IT supplier held to ransom by hackers","1660220918000","Its IT provider says it may take three or four weeks to fully recover from the cyber-attack.","https://www.bbc.co.uk/news/technology-62506039?at_medium=RSS&at_campaign=KARANGA"
"46","Commonwealth Games takes big step towards esports","1660172514000","Competitive gaming may soon be added to the Commonwealth Games programme, after a successful test event in Birmingham.","https://www.bbc.co.uk/news/technology-62498889?at_medium=RSS&at_campaign=KARANGA"
"47","Meta's chatbot says the company 'exploits people'","1660179051000","The new prototype doesn't think much of the company's CEO, Mark Zuckerberg, either.","https://www.bbc.co.uk/news/technology-62497674?at_medium=RSS&at_campaign=KARANGA"
"48","Disney adds subscribers but warns over cricket loss","1660200814000","The media giant is gaining subscribers as it details plans to launch an ad-supported service in December.","https://www.bbc.co.uk/news/business-62500520?at_medium=RSS&at_campaign=KARANGA"
"49","Elon Musk sells $6.9bn of Tesla shares as Twitter lawsuit looms","1660106157000","The world's richest man says he needs the money in case he is forced to buy Twitter for $44bn.","https://www.bbc.co.uk/news/business-62488144?at_medium=RSS&at_campaign=KARANGA"
"50","US invests $280bn in high tech to compete with China","1660062860000","US President Joe Biden said the new funding for tech would keep the US competitive.","https://www.bbc.co.uk/news/business-62482141?at_medium=RSS&at_campaign=KARANGA"
"51","WhatsApp: Mark Zuckerberg reveals new privacy features","1660044701000","The changes will let users silently leave group chats and control who sees their online status.","https://www.bbc.co.uk/news/technology-62464243?at_medium=RSS&at_campaign=KARANGA"
"52","NHS 111 software outage confirmed as cyber-attack","1659787705000","The problems are reported to have impacted referrals from the NHS 111 helpline to out-of-hours GPs.","https://www.bbc.co.uk/news/uk-wales-62442127?at_medium=RSS&at_campaign=KARANGA"
"53","How will humans fare against robo-footballers?","1659973698000","Omar Mehtab visits the home of RoboCup champions Tech United to challenge them to a match.","https://www.bbc.co.uk/news/technology-62254007?at_medium=RSS&at_campaign=KARANGA"
"54","UK Parliament closes TikTok account after China data warning","1659537431000","Senior MPs had raised data security concerns and had called for the account to be taken down.","https://www.bbc.co.uk/news/uk-politics-62410234?at_medium=RSS&at_campaign=KARANGA"
"55","How a small Hong Kong tech firm saw its shares soar","1659590092000","The meteoric rise of AMTD Digital's shares has been likened to the so-called ""meme stock"" phenomenon.","https://www.bbc.co.uk/news/business-62417010?at_medium=RSS&at_campaign=KARANGA"
"56","Booking.com scam: Tourists descend on north London private home","1659522564000","A woman says she feels vulnerable after dozens of tourists arrived at her private home throughout July.","https://www.bbc.co.uk/news/uk-england-london-62407046?at_medium=RSS&at_campaign=KARANGA"
"57","Tinder: CEO Renate Nyborg to leave dating app after one year","1659517308000","Renate Nyborg's exit is part of a major shake-up of the dating app's management and strategy.","https://www.bbc.co.uk/news/business-62402874?at_medium=RSS&at_campaign=KARANGA"
"58","China launches second module for its space station Heavenly Palace","1658669874000","Tiangong or Heavenly Palace is scheduled to be operational by the end of 2022.","https://www.bbc.co.uk/news/world-asia-china-62282862?at_medium=RSS&at_campaign=KARANGA"
"59","Hands-on with the Nothing 1 phone","1657639768000","UK company Nothing's first handset features hundreds of LED lights and has had 200,000 pre-orders.","https://www.bbc.co.uk/news/technology-62140444?at_medium=RSS&at_campaign=KARANGA"
"60","How streaming videos gives a Danish city hot water","1657641570000","A datacentre is cooling its servers while providing nearby residents with heating.","https://www.bbc.co.uk/news/technology-62076634?at_medium=RSS&at_campaign=KARANGA"
"61","Neill Blomkamp: Why I am making video game Off The Grid","1657276777000","The free-to-play game, featuring a narrative element, will see 150 players fight to be the last one.","https://www.bbc.co.uk/news/technology-61979994?at_medium=RSS&at_campaign=KARANGA"
"62","Ukraine war: President Zelensky's 3D projection asks tech sector for help","1656674293000","The Ukrainian president has been outlining his vision for the technology sector in his country.","https://www.bbc.co.uk/news/technology-61993100?at_medium=RSS&at_campaign=KARANGA"
"63","Can a sleepy Japanese town become Asia's Silicon Valley?","1661122949000","A school for tech entrepreneurs will open its doors in April 2023 in the Tokushima town of Kamiyama.","https://www.bbc.co.uk/news/business-62463974?at_medium=RSS&at_campaign=KARANGA"
"64","How to make movies without a huge carbon footprint","1660691203000","The film and TV industry is switching towards greener energy sources but the transition has challenges.","https://www.bbc.co.uk/news/business-62051070?at_medium=RSS&at_campaign=KARANGA"
"65","The tech aiming to prevent lost airline luggage","1660555412000","With millions of bags and suitcases going missing this summer, technology may offer the solution.","https://www.bbc.co.uk/news/business-62446937?at_medium=RSS&at_campaign=KARANGA"
"66","High and low-tech ways to tackle India's water crisis","1660258974000","India's water situation requires a big investment in tech and many small projects on the ground.","https://www.bbc.co.uk/news/business-61965419?at_medium=RSS&at_campaign=KARANGA"
"67","Are we falling in love with robots?","1659999828000","Far from being scary, people who actually live with robots are finding them endearing.","https://www.bbc.co.uk/news/business-62007675?at_medium=RSS&at_campaign=KARANGA"
"68","The plans for giant seaweed farms in European waters","1659914207000","As worldwide sales of the algae soar, the European Union wants to establish giant seaweed farms.","https://www.bbc.co.uk/news/business-62407504?at_medium=RSS&at_campaign=KARANGA"
"69","Can drumming reconnect you to your colleagues?","1659654252000","Companies are having to work extra hard to make their staff feel connected to their organisation.","https://www.bbc.co.uk/news/business-62061572?at_medium=RSS&at_campaign=KARANGA"
"70","How rangers are using AI to help protect India's tigers","1659395258000","India's tigers roam across vast areas, so artificial intelligence is being developed to help track them.","https://www.bbc.co.uk/news/business-61824904?at_medium=RSS&at_campaign=KARANGA"
"71","The space tech helping to tackle deforestation","1659308451000","How the International Space Station is helping to tackle deforestation","https://www.bbc.co.uk/news/business-62264710?at_medium=RSS&at_campaign=KARANGA"
"72","The super material reinforcing rinks, cars and buildings","1659049787000","From roller rinks to skyscrapers the addition of graphene could make concrete construction stronger.","https://www.bbc.co.uk/news/business-61913871?at_medium=RSS&at_campaign=KARANGA"
"73","Digital India: How India's digital revolution is connecting millions","1658796244000","Access to the internet has transformed the lives of millions in India.","https://www.bbc.co.uk/news/world-asia-india-62262512?at_medium=RSS&at_campaign=KARANGA"
"74","A mind-reading combat jet for the future","1658791530000","The Tempest fighter jet will have artificial intelligence tech to monitor and help the pilot.","https://www.bbc.co.uk/news/business-62289737?at_medium=RSS&at_campaign=KARANGA"
"75","The tech helping to bring you your morning coffee","1658704544000","How Brazil, the world's largest grower of coffee, is turning to technology to boost production.","https://www.bbc.co.uk/news/business-62235741?at_medium=RSS&at_campaign=KARANGA"
